,budget,genres,homepage,id,keywords,original_language,Title,overview,popularity,production_companies,production_countries,release_date,revenue,runtime,spoken_languages,status,tagline,title,vote_average,vote_count,Rating
454,25000000,"[{""id"": 28, ""name"": ""Action""}, {""id"": 18, ""name"": ""Drama""}]",http://www.warriorfilm.com/index2.html,59440,"[{""id"": 974, ""name"": ""bank""}, {""id"": 4613, ""name"": ""training""}, {""id"": 9849, ""name"": ""beating""}, {""id"": 9917, ""name"": ""mixed martial arts""}, {""id"": 10508, ""name"": ""teacher""}, {""id"": 14666, ""name"": ""muscleman""}, {""id"": 18543, ""name"": ""combat""}, {""id"": 33457, ""name"": ""alcoholic""}, {""id"": 33610, ""name"": ""gym""}, {""id"": 33611, ""name"": ""exercise""}]",en,Warrior,"The inspirational story of an estranged family that finds redemption in the unlikeliest of places…the MMA ring. Tommy Riordan (Tom Hardy), an ex-marine with a tragic past, returns home and enlists his father (Nick Nolte), a recovering alcoholic and former wrestling coach, to train him for “Sparta”, the biggest MMA tournament ever held. But when Tommy’s underdog brother, Brendan (Joel Edgerton), fights his way into the tournament, the two brothers must finally confront each other and the forces that pulled them apart. What ensues is the most gut-wrenching, soul-stirring, and unforgettable battle of their lives.",51.915025,"[{""name"": ""Solaris Film"", ""id"": 1001}, {""name"": ""Lionsgate"", ""id"": 1632}, {""name"": ""Mimran Schur Pictures"", ""id"": 6573}, {""name"": ""Filmtribe"", ""id"": 12425}]","[{""iso_3166_1"": ""US"", ""name"": ""United States of America""}]",2011-09-09,23057115,140.0,"[{""iso_639_1"": ""en"", ""name"": ""English""}]",Released,Fight for Family,Warrior,7.7,1272,8.2
455,32000000,"[{""id"": 12, ""name"": ""Adventure""}, {""id"": 18, ""name"": ""Drama""}]",http://www.theroad-movie.com/,20766,"[{""id"": 4458, ""name"": ""post-apocalyptic""}, {""id"": 4565, ""name"": ""dystopia""}, {""id"": 4954, ""name"": ""paternity""}, {""id"": 179431, ""name"": ""duringcreditsstinger""}]",en,The Road,"A father and his son walk alone through burned America. Nothing moves in the ravaged landscape save the ash on the wind and water. It is cold enough to crack stones, and, when the snow falls it is gray. The sky is dark. Their destination is the warmer south, although they don't know what, if anything, awaits them there.",41.075532,"[{""name"": ""2929 Productions"", ""id"": 846}, {""name"": ""Dimension Films"", ""id"": 7405}, {""name"": ""Nick Wechsler Productions"", ""id"": 8073}, {""name"": ""Chockstone Pictures"", ""id"": 13649}]","[{""iso_3166_1"": ""US"", ""name"": ""United States of America""}]",2009-11-25,27635305,111.0,"[{""iso_639_1"": ""en"", ""name"": ""English""}]",Released,In a moment the world changed forever.,The Road,6.8,1087,7.3
456,13500000,"[{""id"": 18, ""name"": ""Drama""}, {""id"": 10749, ""name"": ""Romance""}, {""id"": 80, ""name"": ""Crime""}, {""id"": 9648, ""name"": ""Mystery""}]",http://lamiglioreoffertailfilm.it,152742,"[{""id"": 5918, ""name"": ""painting""}, {""id"": 198318, ""name"": ""auctioneer""}, {""id"": 201385, ""name"": ""confidence game""}, {""id"": 220933, ""name"": ""fine art""}, {""id"": 221810, ""name"": ""honey pot""}]",en,La migliore offerta,"Virgil Oldman is a world renowned antiques expert and auctioneer. An eccentric genius, he leads a solitary life, going to extreme lengths to keep his distance from the messiness of human relationships. When appointed by the beautiful but emotionally damaged Claire to oversee the valuation and sale of her family’s priceless art collection, Virgil allows himself to form an attachment to her – and soon he is engulfed by a passion which will rock his bland existence to the core.",30.058263,"[{""name"": ""Paco Cinematografica"", ""id"": 3110}, {""name"": ""Warner Bros."", ""id"": 6194}, {""name"": ""Regione Lazio"", ""id"": 20416}, {""name"": ""Business Location Sudtirol Alto Adige"", ""id"": 20644}, {""name"": ""Friuli Venezia Giulia Film Commission"", ""id"": 38591}, {""name"": ""UniCredit Group"", ""id"": 38592}]","[{""iso_3166_1"": ""IT"", ""name"": ""Italy""}]",2013-01-01,19255873,124.0,"[{""iso_639_1"": ""en"", ""name"": ""English""}]",Released,A Master of Possession. A Crime of Obsession,The Best Offer,7.7,704,7.8
457,25000000,"[{""id"": 53, ""name"": ""Thriller""}, {""id"": 80, ""name"": ""Crime""}, {""id"": 18, ""name"": ""Drama""}]",,109091,"[{""id"": 496, ""name"": ""poetry""}, {""id"": 10909, ""name"": ""lawyer""}, {""id"": 13037, ""name"": ""drug smuggling""}, {""id"": 18230, ""name"": ""drug trafficking""}, {""id"": 183185, ""name"": ""red dress""}]",en,The Counselor,A rich and successful lawyer named Counselor is about to get married to his fiancée but soon meets up with the middle-man known as Westray who tells him his drug trafficking plan has taken a horrible twist and now he must protect himself and his soon bride-to-be lover as the truth of the drug business uncovers and targets become chosen.,35.022028999999996,"[{""name"": ""Ingenious Media"", ""id"": 290}, {""name"": ""Fox 2000 Pictures"", ""id"": 711}, {""name"": ""Scott Free Productions"", ""id"": 1645}, {""name"": ""Kanzaman"", ""id"": 4169}, {""name"": ""Nick Wechsler Productions"", ""id"": 8073}, {""name"": ""Big Screen Productions"", ""id"": 10893}, {""name"": ""Chockstone Pictures"", ""id"": 13649}, {""name"": ""Translux"", ""id"": 14384}, {""name"": ""TSG Entertainment"", ""id"": 22213}]","[{""iso_3166_1"": ""GB"", ""name"": ""United Kingdom""}, {""iso_3166_1"": ""US"", ""name"": ""United States of America""}]",2013-10-25,71009334,117.0,"[{""iso_639_1"": ""en"", ""name"": ""English""}]",Released,Sin Is A Choice.,The Counselor,5.0,712,5.3
458,24000000,"[{""id"": 18, ""name"": ""Drama""}]",http://www.rocky.com/,1246,"[{""id"": 276, ""name"": ""philadelphia""}, {""id"": 396, ""name"": ""transporter""}, {""id"": 1721, ""name"": ""fight""}, {""id"": 2038, ""name"": ""love of one's life""}, {""id"": 2416, ""name"": ""publicity""}, {""id"": 2792, ""name"": ""boxer""}, {""id"": 2968, ""name"": ""grave""}, {""id"": 3393, ""name"": ""tombstone""}, {""id"": 3586, ""name"": ""tv station""}, {""id"": 4487, ""name"": ""boxing match""}, {""id"": 4610, ""name"": ""comeback""}, {""id"": 4613, ""name"": ""training""}, {""id"": 5167, ""name"": ""restaurant owner""}, {""id"": 5378, ""name"": ""world champion""}, {""id"": 5379, ""name"": ""challenger""}, {""id"": 5380, ""name"": ""virtual fight""}, {""id"": 6066, ""name"": ""defeat""}, {""id"": 6067, ""name"": ""victory""}, {""id"": 10163, ""name"": ""cancer""}, {""id"": 155464, ""name"": ""over-the-hill fighter""}]",en,Rocky Balboa,"When he loses a highly publicized virtual boxing match to ex-champ Rocky Balboa, reigning heavyweight titleholder, Mason Dixon retaliates by challenging Rocky to a nationally televised, 10-round exhibition bout. To the surprise of his son and friends, Rocky agrees to come out of retirement and face an opponent who's faster, stronger and thirty years his junior.",30.445257,"[{""name"": ""Columbia Pictures"", ""id"": 5}, {""name"": ""Revolution Studios"", ""id"": 497}, {""name"": ""Rogue Marble"", ""id"": 696}, {""name"": ""Metro-Goldwyn-Mayer (MGM)"", ""id"": 8411}]","[{""iso_3166_1"": ""US"", ""name"": ""United States of America""}]",2006-12-20,155721132,102.0,"[{""iso_639_1"": ""en"", ""name"": ""English""}, {""iso_639_1"": ""es"", ""name"": ""Espa\u00f1ol""}]",Released,It ain't over 'til it's over.,Rocky Balboa,6.5,835,7.2
459,8200000,"[{""id"": 18, ""name"": ""Drama""}, {""id"": 10751, ""name"": ""Family""}, {""id"": 10402, ""name"": ""Music""}, {""id"": 10749, ""name"": ""Romance""}]",,1788,"[{""id"": 246, ""name"": ""dancing""}, {""id"": 733, ""name"": ""dancer""}, {""id"": 1691, ""name"": ""dance""}, {""id"": 6027, ""name"": ""music""}, {""id"": 207010, ""name"": ""dance teacher""}]",en,Footloose,"When teenager Ren and his family move from big-city Chicago to a small town in the West, he's in for a real case of culture shock.",25.03414,"[{""name"": ""Paramount Pictures"", ""id"": 4}, {""name"": ""IndieProd Company Productions"", ""id"": 959}]","[{""iso_3166_1"": ""US"", ""name"": ""United States of America""}]",1984-02-17,80035402,107.0,"[{""iso_639_1"": ""en"", ""name"": ""English""}]",Released,,Footloose,6.4,505,5.9
460,24000000,"[{""id"": 35, ""name"": ""Comedy""}]",http://www.zackandmiri.com,10358,"[{""id"": 445, ""name"": ""pornography""}, {""id"": 2038, ""name"": ""love of one's life""}, {""id"": 3200, ""name"": ""platonic love""}, {""id"": 5593, ""name"": ""pornographic video""}, {""id"": 12392, ""name"": ""best friend""}, {""id"": 170827, ""name"": ""sex comedy""}, {""id"": 178329, ""name"": ""best friends in love""}, {""id"": 179430, ""name"": ""aftercreditsstinger""}, {""id"": 179431, ""name"": ""duringcreditsstinger""}]",en,Zack and Miri Make a Porno,"Lifelong platonic friends Zack and Miri look to solve their respective cash-flow problems by making an adult film together. As the cameras roll, however, the duo begin to sense that they may have more feelings for each other than they previously thought.",27.326465999999996,"[{""name"": ""Blue Askew"", ""id"": 2599}, {""name"": ""View Askew Productions"", ""id"": 16934}]","[{""iso_3166_1"": ""US"", ""name"": ""United States of America""}]",2008-09-18,42105111,102.0,"[{""iso_639_1"": ""en"", ""name"": ""English""}]",Released,What would you do to get out of debt?,Zack and Miri Make a Porno,6.1,721,6.6
461,24000000,"[{""id"": 35, ""name"": ""Comedy""}, {""id"": 27, ""name"": ""Horror""}]",http://www.piranha-3d.com,43593,"[{""id"": 3342, ""name"": ""yacht""}, {""id"": 9732, ""name"": ""movie in movie""}, {""id"": 10503, ""name"": ""scuba diving""}, {""id"": 158045, ""name"": ""piranha""}, {""id"": 158054, ""name"": ""spring break""}, {""id"": 158072, ""name"": ""man eaten by monster""}, {""id"": 209714, ""name"": ""3d""}]",en,Piranha 3D,"Each year the population of sleepy Lake Victoria, Arizona explodes from 5,000 to 50,000 residents for the annual Spring Break celebration. But then, an earthquake opens an underwater chasm, releasing an enormous swarm of ancient Piranha that have been dormant for thousands of years, now with a taste for human flesh. This year, there's something more to worry about than the usual hangovers and complaints from locals, a new type of terror is about to be cut loose on Lake Victoria.",23.343839000000003,"[{""name"": ""The Weinstein Company"", ""id"": 308}, {""name"": ""Atmosphere Entertainment MM"", ""id"": 2995}, {""name"": ""Chako Film Company"", ""id"": 7332}, {""name"": ""Dimension Films"", ""id"": 7405}, {""name"": ""Intellectual Properties Worldwide"", ""id"": 18524}, {""name"": ""Aja / Levasseur Productions"", ""id"": 22596}]","[{""iso_3166_1"": ""US"", ""name"": ""United States of America""}]",2010-08-20,83188165,88.0,"[{""iso_639_1"": ""en"", ""name"": ""English""}]",Released,There's something in the water.,Piranha 3D,5.3,581,5.5
462,24000000,"[{""id"": 80, ""name"": ""Crime""}, {""id"": 18, ""name"": ""Drama""}, {""id"": 28, ""name"": ""Action""}, {""id"": 53, ""name"": ""Thriller""}]",http://www.fasterthemovie.com/,41283,[],en,Faster,"Driver (Dwayne Johnson) has spent the last 10 years in prison planning revenge for the murder of his brother. Now that Driver is free to carry out his deadly plan only two men stand in his way- Billy Bob Thornton plays a veteran cop and Oliver Jackson-Cohen, a crazy hitman. With those two close on his trail, Driver races to carry out his mission as the mystery surrounding his brothers murder deepens.",26.324873999999998,"[{""name"": ""Castle Rock Entertainment"", ""id"": 97}, {""name"": ""TriStar Pictures"", ""id"": 559}, {""name"": ""State Street Pictures"", ""id"": 3356}, {""name"": ""CBS Films"", ""id"": 5490}]","[{""iso_3166_1"": ""US"", ""name"": ""United States of America""}]",2010-11-23,23081726,98.0,"[{""iso_639_1"": ""en"", ""name"": ""English""}]",Released,Slow Justice is no Justice,Faster,6.1,568,6.5
463,23600000,"[{""id"": 35, ""name"": ""Comedy""}, {""id"": 27, ""name"": ""Horror""}]",http://www.zombieland.com/,19908,"[{""id"": 521, ""name"": ""washington d.c.""}, {""id"": 1156, ""name"": ""sister sister relationship""}, {""id"": 4458, ""name"": ""post-apocalyptic""}, {""id"": 7312, ""name"": ""road trip""}, {""id"": 8636, ""name"": ""blood splatter""}, {""id"": 9755, ""name"": ""parody""}, {""id"": 10349, ""name"": ""survival""}, {""id"": 12377, ""name"": ""zombie""}, {""id"": 14819, ""name"": ""violence""}, {""id"": 50009, ""name"": ""survival horror""}, {""id"": 155582, ""name"": ""amusement park""}, {""id"": 167068, ""name"": ""twinkie""}, {""id"": 167081, ""name"": ""body count""}, {""id"": 167085, ""name"": ""zombification""}, {""id"": 167095, ""name"": ""disposing of a dead body""}, {""id"": 167103, ""name"": ""bitten on the arm""}, {""id"": 167104, ""name"": ""loner""}, {""id"": 179430, ""name"": ""aftercreditsstinger""}, {""id"": 186565, ""name"": ""zombie apocalypse""}, {""id"": 235354, ""name"": ""fear of clowns""}]",en,Zombieland,"Columbus has made a habit of running from what scares him. Tallahassee doesn't have fears. If he did, he'd kick their ever-living ass. In a world overrun by zombies, these two are perfectly evolved survivors. But now, they're about to stare down the most terrifying prospect of all: each other.",57.300674,"[{""name"": ""Columbia Pictures"", ""id"": 5}, {""name"": ""Relativity Media"", ""id"": 7295}, {""name"": ""Pariah"", ""id"": 11733}]","[{""iso_3166_1"": ""US"", ""name"": ""United States of America""}]",2009-10-07,102391382,88.0,"[{""iso_639_1"": ""en"", ""name"": ""English""}]",Released,This place is so dead,Zombieland,7.2,3550,7.7
464,23000000,"[{""id"": 10749, ""name"": ""Romance""}, {""id"": 878, ""name"": ""Science Fiction""}, {""id"": 18, ""name"": ""Drama""}]",http://www.herthemovie.com/,152601,"[{""id"": 310, ""name"": ""artificial intelligence""}, {""id"": 6104, ""name"": ""computer""}, {""id"": 9673, ""name"": ""love""}, {""id"": 9957, ""name"": ""loneliness""}, {""id"": 12375, ""name"": ""transhumanism""}, {""id"": 34265, ""name"": ""heartbreak""}, {""id"": 40847, ""name"": ""near future""}, {""id"": 223540, ""name"": ""singularity""}, {""id"": 224279, ""name"": ""bittersweet""}]",en,Her,"In the not so distant future, Theodore, a lonely writer purchases a newly developed operating system designed to meet the user's every needs. To Theordore's surprise, a romantic relationship develops between him and his operating system. This unconventional love story blends science fiction and romance in a sweet tale that explores the nature of love and the ways that technology isolates and connects us all.",53.682367000000006,"[{""name"": ""Warner Bros."", ""id"": 6194}, {""name"": ""Annapurna Pictures"", ""id"": 13184}]","[{""iso_3166_1"": ""CN"", ""name"": ""China""}, {""iso_3166_1"": ""US"", ""name"": ""United States of America""}]",2013-12-18,47351251,126.0,"[{""iso_639_1"": ""en"", ""name"": ""English""}]",Released,A Spike Jonze Love Story,Her,7.9,4097,8.0
465,25000000,"[{""id"": 27, ""name"": ""Horror""}, {""id"": 53, ""name"": ""Thriller""}]",http://www.1408-themovie.com/,3021,"[{""id"": 236, ""name"": ""suicide""}, {""id"": 242, ""name"": ""new york""}, {""id"": 612, ""name"": ""hotel""}, {""id"": 657, ""name"": ""fire""}, {""id"": 922, ""name"": ""hotel room""}, {""id"": 1157, ""name"": ""wife husband relationship""}, {""id"": 1252, ""name"": ""suicide attempt""}, {""id"": 2872, ""name"": ""window""}, {""id"": 3255, ""name"": ""door""}, {""id"": 3358, ""name"": ""haunted house""}, {""id"": 3664, ""name"": ""research""}, {""id"": 5280, ""name"": ""ghost world""}, {""id"": 5918, ""name"": ""painting""}, {""id"": 6103, ""name"": ""telephone""}, {""id"": 6381, ""name"": ""loss of daughter""}, {""id"": 11221, ""name"": ""blood""}]",en,1408,"A man who specializes in debunking paranormal occurrences checks into the fabled room 1408 in the Dolphin Hotel. Soon after settling in, he confronts genuine terror.",35.169779,"[{""name"": ""The Weinstein Company"", ""id"": 308}, {""name"": ""Di Bonaventura Pictures"", ""id"": 435}, {""name"": ""Dimension Films"", ""id"": 7405}]","[{""iso_3166_1"": ""US"", ""name"": ""United States of America""}]",2007-07-12,94679598,104.0,"[{""iso_639_1"": ""en"", ""name"": ""English""}]",Released,The only demons in room 1408 are those within you.,1408,6.5,1343,6.8
466,22000000,"[{""id"": 35, ""name"": ""Comedy""}, {""id"": 10751, ""name"": ""Family""}]",,82650,"[{""id"": 12392, ""name"": ""best friend""}, {""id"": 177804, ""name"": ""sweet sixteen""}, {""id"": 179431, ""name"": ""duringcreditsstinger""}]",en,Diary of a Wimpy Kid: Dog Days,"School is out and Greg is ready for the days of summer, when all his plans go wrong. What on earth is he going to do all summer?",13.410919,"[{""name"": ""Fox 2000 Pictures"", ""id"": 711}]","[{""iso_3166_1"": ""US"", ""name"": ""United States of America""}]",2012-08-02,77112176,94.0,"[{""iso_639_1"": ""en"", ""name"": ""English""}]",Released,School's Out for the summer,Diary of a Wimpy Kid: Dog Days,6.0,223,6.4
467,22000000,"[{""id"": 35, ""name"": ""Comedy""}, {""id"": 18, ""name"": ""Drama""}, {""id"": 9648, ""name"": ""Mystery""}]",http://www.hailcaesar-film.com/ww/,270487,"[{""id"": 736, ""name"": ""journalist""}, {""id"": 977, ""name"": ""cat""}, {""id"": 1336, ""name"": ""ransom""}, {""id"": 1930, ""name"": ""kidnapping""}, {""id"": 5049, ""name"": ""ancient rome""}, {""id"": 9732, ""name"": ""movie in movie""}, {""id"": 12396, ""name"": ""hollywood""}, {""id"": 15060, ""name"": ""period drama""}]",en,"Hail, Caesar!","Tells the comedic tale of Eddie Mannix, a fixer who worked for the Hollywood studios in the 1950s. The story finds him at work when a star mysteriously disappears in the middle of filming.",39.006187,"[{""name"": ""Universal Pictures"", ""id"": 33}, {""name"": ""Mike Zoss Productions"", ""id"": 2092}, {""name"": ""Working Title Films"", ""id"": 10163}]","[{""iso_3166_1"": ""US"", ""name"": ""United States of America""}]",2016-02-05,63647656,106.0,"[{""iso_639_1"": ""en"", ""name"": ""English""}]",Released,Lights. Camera. Abduction.,"Hail, Caesar!",5.7,1309,6.3
468,22000000,"[{""id"": 53, ""name"": ""Thriller""}, {""id"": 18, ""name"": ""Drama""}, {""id"": 80, ""name"": ""Crime""}]",,164457,"[{""id"": 378, ""name"": ""prison""}, {""id"": 380, ""name"": ""brother brother relationship""}, {""id"": 2231, ""name"": ""drug dealer""}, {""id"": 5301, ""name"": ""brother""}, {""id"": 9748, ""name"": ""revenge""}, {""id"": 11494, ""name"": ""drug use""}, {""id"": 13063, ""name"": ""car accident""}, {""id"": 15108, ""name"": ""justice""}, {""id"": 18035, ""name"": ""family""}, {""id"": 166816, ""name"": ""bare knuckle fighting""}, {""id"": 195621, ""name"": ""rust belt""}, {""id"": 207268, ""name"": ""neo-noir""}, {""id"": 207935, ""name"": ""manslaughter""}, {""id"": 238189, ""name"": ""social decay""}, {""id"": 238190, ""name"": ""ptsd""}]",en,Out of the Furnace,"Two brothers live in the economically-depressed Rust Belt, when a cruel twist of fate lands one in prison. His brother is then lured into one of the most violent crime rings in the Northeast.",29.230297999999998,"[{""name"": ""Appian Way"", ""id"": 562}, {""name"": ""Scott Free Productions"", ""id"": 1645}, {""name"": ""Relativity Media"", ""id"": 7295}, {""name"": ""Energy Entertainment"", ""id"": 18617}, {""name"": ""Red Granite Pictures"", ""id"": 19177}]","[{""iso_3166_1"": ""US"", ""name"": ""United States of America""}]",2013-12-06,15400000,116.0,"[{""iso_639_1"": ""en"", ""name"": ""English""}]",Released,Sometimes your battles choose you.,Out of the Furnace,6.5,720,6.8
469,17000000,"[{""id"": 10749, ""name"": ""Romance""}, {""id"": 35, ""name"": ""Comedy""}]",,81836,"[{""id"": 588, ""name"": ""rome""}, {""id"": 156063, ""name"": ""expatriate""}, {""id"": 156934, ""name"": ""episodic""}]",en,To Rome with Love,"Four tales unfold in the Eternal City: While vacationing in Rome, architect John encounters a young man whose romantic woes remind him of a painful incident from his own youth; retired opera director Jerry discovers a mortician with an amazing voice, and he seizes the opportunity to rejuvenate his own flagging career; a young couple have separate romantic interludes; a spotlight shines on an ordinary man.",15.013385999999999,"[{""name"": ""Gravier Productions"", ""id"": 1824}, {""name"": ""Medusa Film"", ""id"": 6246}, {""name"": ""Mediapro"", ""id"": 12010}, {""name"": ""Perdido Productions"", ""id"": 12966}]","[{""iso_3166_1"": ""IT"", ""name"": ""Italy""}, {""iso_3166_1"": ""ES"", ""name"": ""Spain""}, {""iso_3166_1"": ""US"", ""name"": ""United States of America""}]",2012-04-20,73244881,111.0,"[{""iso_639_1"": ""it"", ""name"": ""Italiano""}, {""iso_639_1"": ""en"", ""name"": ""English""}]",Released,,To Rome with Love,5.6,546,6.3
470,21000000,"[{""id"": 18, ""name"": ""Drama""}, {""id"": 35, ""name"": ""Comedy""}, {""id"": 10749, ""name"": ""Romance""}]",http://silverliningsplaybookmovie.com/,82693,"[{""id"": 246, ""name"": ""dancing""}, {""id"": 276, ""name"": ""philadelphia""}, {""id"": 795, ""name"": ""running""}, {""id"": 818, ""name"": ""based on novel""}, {""id"": 894, ""name"": ""depression""}, {""id"": 3344, ""name"": ""letter""}, {""id"": 6054, ""name"": ""friendship""}, {""id"": 10226, ""name"": ""neighbor""}, {""id"": 41329, ""name"": ""mental illness""}, {""id"": 155816, ""name"": ""ex-wife""}, {""id"": 162970, ""name"": ""institutionalization""}, {""id"": 189447, ""name"": ""bipolar""}, {""id"": 189881, ""name"": ""philadelphia eagles""}]",en,Silver Linings Playbook,"After spending eight months in a mental institution, a former teacher moves back in with his parents and tries to reconcile with his ex-wife.",63.599973,"[{""name"": ""The Weinstein Company"", ""id"": 308}]","[{""iso_3166_1"": ""US"", ""name"": ""United States of America""}]",2012-09-08,205738714,122.0,"[{""iso_639_1"": ""en"", ""name"": ""English""}]",Released,Watch For The Signs,Silver Linings Playbook,6.9,4742,7.8
471,21000000,"[{""id"": 80, ""name"": ""Crime""}, {""id"": 18, ""name"": ""Drama""}]",http://www.freedomwriters.com/,1646,"[{""id"": 577, ""name"": ""black people""}, {""id"": 818, ""name"": ""based on novel""}, {""id"": 1739, ""name"": ""holocaust""}, {""id"": 2394, ""name"": ""ghetto""}, {""id"": 2913, ""name"": ""diary""}, {""id"": 4508, ""name"": ""principal witness ""}, {""id"": 5565, ""name"": ""biography""}, {""id"": 5600, ""name"": ""daughter""}, {""id"": 6270, ""name"": ""high school""}, {""id"": 6984, ""name"": ""racial segregation""}, {""id"": 6985, ""name"": ""anne frank""}, {""id"": 6986, ""name"": ""school excursion""}, {""id"": 6987, ""name"": ""idealism""}, {""id"": 7920, ""name"": ""violence in schools""}, {""id"": 41385, ""name"": ""racial tension""}, {""id"": 181858, ""name"": ""gang violence""}, {""id"": 185722, ""name"": ""based on true events""}]",en,Freedom Writers,"A young teacher inspires her class of at-risk students to learn tolerance, apply themselves, and pursue education beyond high school.",17.746980999999998,"[{""name"": ""Double Feature Films"", ""id"": 215}, {""name"": ""Jersey Films"", ""id"": 216}, {""name"": ""Kernos Filmproduktionsgesellschaft & Company"", ""id"": 20396}]","[{""iso_3166_1"": ""DE"", ""name"": ""Germany""}, {""iso_3166_1"": ""US"", ""name"": ""United States of America""}]",2007-01-05,41170784,123.0,"[{""iso_639_1"": ""en"", ""name"": ""English""}, {""iso_639_1"": ""es"", ""name"": ""Espa\u00f1ol""}]",Released,Their story. Their world. Their future.,Freedom Writers,7.5,356,7.5
472,20000000,"[{""id"": 18, ""name"": ""Drama""}, {""id"": 28, ""name"": ""Action""}]",http://www.neverbackdownthemovie.com/,8456,"[{""id"": 526, ""name"": ""rebel""}, {""id"": 779, ""name"": ""martial arts""}, {""id"": 1353, ""name"": ""underground""}, {""id"": 1721, ""name"": ""fight""}, {""id"": 4613, ""name"": ""training""}, {""id"": 5400, ""name"": ""champion""}, {""id"": 6075, ""name"": ""sport""}, {""id"": 6270, ""name"": ""high school""}, {""id"": 8508, ""name"": ""party""}, {""id"": 9748, ""name"": ""revenge""}, {""id"": 11221, ""name"": ""blood""}, {""id"": 12612, ""name"": ""nemesis""}, {""id"": 14819, ""name"": ""violence""}, {""id"": 156801, ""name"": ""club""}, {""id"": 174244, ""name"": ""brawl""}]",en,Never Back Down,"Rebellious Jake Tyler is lured into an ultimate underground fight Scene at his new high school, after receiving threats to the safety of his friends and family Jake decides to seek the mentoring of a veteran fighter who trains him for one final no-holds-barred elimination fight with his nemesis and local martial arts champion Ryan McCarthy.",26.21425,"[{""name"": ""Summit Entertainment"", ""id"": 491}, {""name"": ""Mandalay Pictures"", ""id"": 551}, {""name"": ""Baumgarten Management and Productions (BMP)"", ""id"": 23423}]","[{""iso_3166_1"": ""US"", ""name"": ""United States of America""}]",2008-03-04,41627431,115.0,"[{""iso_639_1"": ""en"", ""name"": ""English""}]",Released,Win or lose... Everyone has their fight.,Never Back Down,6.4,497,6.6
