,budget,genres,homepage,id,keywords,original_language,Title,overview,popularity,production_companies,production_countries,release_date,revenue,runtime,spoken_languages,status,tagline,title,vote_average,vote_count,Rating
284,50200000,"[{""id"": 878, ""name"": ""Science Fiction""}, {""id"": 53, ""name"": ""Thriller""}, {""id"": 10749, ""name"": ""Romance""}]",http://www.theadjustmentbureau.com/,38050,"[{""id"": 612, ""name"": ""hotel""}, {""id"": 733, ""name"": ""dancer""}, {""id"": 2656, ""name"": ""hat""}, {""id"": 2944, ""name"": ""senator""}, {""id"": 2964, ""name"": ""future""}, {""id"": 4427, ""name"": ""honesty""}, {""id"": 4812, ""name"": ""plan""}, {""id"": 5091, ""name"": ""kiss""}, {""id"": 6001, ""name"": ""speech""}, {""id"": 6038, ""name"": ""marriage""}, {""id"": 6083, ""name"": ""politician""}, {""id"": 6511, ""name"": ""alone""}, {""id"": 10855, ""name"": ""fate""}, {""id"": 14967, ""name"": ""foot chase""}, {""id"": 18073, ""name"": ""covert agency""}, {""id"": 18074, ""name"": ""courthouse""}, {""id"": 18075, ""name"": ""political campaign""}, {""id"": 156866, ""name"": ""based on short story""}]",en,The Adjustment Bureau,"A man glimpses the future Fate has planned for him – and chooses to fight for his own destiny. Battling the powerful Adjustment Bureau across, under and through the streets of New York, he risks his destined greatness to be with the only woman he's ever loved.",26.60772,"[{""name"": ""Universal Pictures"", ""id"": 33}, {""name"": ""Media Rights Capital"", ""id"": 2531}, {""name"": ""Gambit Pictures"", ""id"": 6933}, {""name"": ""Electric Shepherd Productions"", ""id"": 11834}]","[{""iso_3166_1"": ""US"", ""name"": ""United States of America""}]",2011-03-03,127869379,106.0,"[{""iso_639_1"": ""en"", ""name"": ""English""}]",Released,Fight for your fate.,The Adjustment Bureau,6.5,1652,7.1
285,50000000,"[{""id"": 35, ""name"": ""Comedy""}, {""id"": 14, ""name"": ""Fantasy""}]",http://www.tedisreal.com/,72105,"[{""id"": 6054, ""name"": ""friendship""}, {""id"": 9673, ""name"": ""love""}, {""id"": 158162, ""name"": ""teddy bear""}, {""id"": 187065, ""name"": ""toy comes to life""}, {""id"": 187084, ""name"": ""wishes come true""}]",en,Ted,"John Bennett, a man whose childhood wish of bringing his teddy bear to life came true, now must decide between keeping the relationship with the bear or his girlfriend, Lori.",68.87691,"[{""name"": ""Universal Pictures"", ""id"": 33}, {""name"": ""Media Rights Capital"", ""id"": 2531}, {""name"": ""Fuzzy Door Productions"", ""id"": 8789}]","[{""iso_3166_1"": ""US"", ""name"": ""United States of America""}]",2012-06-29,549368315,106.0,"[{""iso_639_1"": ""en"", ""name"": ""English""}]",Released,Ted is coming.,Ted,6.3,4697,7.0
286,50000000,"[{""id"": 53, ""name"": ""Thriller""}, {""id"": 878, ""name"": ""Science Fiction""}, {""id"": 9648, ""name"": ""Mystery""}]",http://www.super8-movie.com/,37686,"[{""id"": 1228, ""name"": ""1970s""}, {""id"": 1328, ""name"": ""secret""}, {""id"": 9951, ""name"": ""alien""}, {""id"": 10663, ""name"": ""train crash""}, {""id"": 13132, ""name"": ""pistol""}, {""id"": 17994, ""name"": ""firecracker""}, {""id"": 179431, ""name"": ""duringcreditsstinger""}]",en,Super 8,"In 1979 Ohio, several youngsters are making a zombie movie with a Super-8 camera. In the midst of filming, the friends witness a horrifying train derailment and are lucky to escape with their lives. They soon discover that the catastrophe was no accident, as a series of unexplained events and disappearances soon follows. Deputy Jackson Lamb, the father of one of the kids, searches for the terrifying truth behind the crash.",37.069253,"[{""name"": ""Paramount Pictures"", ""id"": 4}, {""name"": ""Amblin Entertainment"", ""id"": 56}, {""name"": ""Bad Robot"", ""id"": 11461}, {""name"": ""K/O Camera Toys"", ""id"": 23300}]","[{""iso_3166_1"": ""US"", ""name"": ""United States of America""}]",2011-06-08,260095987,112.0,"[{""iso_639_1"": ""en"", ""name"": ""English""}]",Released,It Arrives.,Super 8,6.6,2435,7.1
287,50000000,"[{""id"": 80, ""name"": ""Crime""}, {""id"": 35, ""name"": ""Comedy""}, {""id"": 28, ""name"": ""Action""}]",http://www.22jumpstreetmovie.com,187017,"[{""id"": 6270, ""name"": ""high school""}, {""id"": 11199, ""name"": ""undercover cop""}, {""id"": 167541, ""name"": ""buddy comedy""}, {""id"": 179430, ""name"": ""aftercreditsstinger""}, {""id"": 179431, ""name"": ""duringcreditsstinger""}]",en,22 Jump Street,"After making their way through high school (twice), big changes are in store for officers Schmidt and Jenko when they go deep undercover at a local college. But when Jenko meets a kindred spirit on the football team, and Schmidt infiltrates the bohemian art major scene, they begin to question their partnership. Now they don't have to just crack the case - they have to figure out if they can have a mature relationship. If these two overgrown adolescents can grow from freshmen into real men, college might be the best thing that ever happened to them.",52.380982,"[{""name"": ""Columbia Pictures"", ""id"": 5}, {""name"": ""Original Film"", ""id"": 333}, {""name"": ""Media Rights Capital"", ""id"": 2531}, {""name"": ""Metro-Goldwyn-Mayer (MGM)"", ""id"": 8411}, {""name"": ""Cannell Studios"", ""id"": 9194}, {""name"": ""LStar Capital"", ""id"": 34034}, {""name"": ""33andOut Productions"", ""id"": 34035}, {""name"": ""JHF Productions"", ""id"": 34036}]","[{""iso_3166_1"": ""US"", ""name"": ""United States of America""}]",2014-06-05,188441614,112.0,"[{""iso_639_1"": ""en"", ""name"": ""English""}]",Released,They're not 21 anymore,22 Jump Street,7.0,3319,7.1
288,50000000,"[{""id"": 28, ""name"": ""Action""}, {""id"": 35, ""name"": ""Comedy""}]",http://www.centralintelligencemovie.com/,302699,"[{""id"": 470, ""name"": ""spy""}, {""id"": 591, ""name"": ""cia""}, {""id"": 11134, ""name"": ""espionage""}, {""id"": 161213, ""name"": ""high school reunion""}, {""id"": 173367, ""name"": ""reference to facebook""}, {""id"": 207697, ""name"": ""accountant""}]",en,Central Intelligence,"After he reunites with an old pal through Facebook, a mild-mannered accountant is lured into the world of international espionage.",45.318703,"[{""name"": ""New Line Cinema"", ""id"": 12}, {""name"": ""Universal Pictures"", ""id"": 33}, {""name"": ""Bluegrass Films"", ""id"": 13778}, {""name"": ""Principato-Young Entertainment"", ""id"": 37845}]","[{""iso_3166_1"": ""US"", ""name"": ""United States of America""}]",2016-06-15,216972543,107.0,"[{""iso_639_1"": ""en"", ""name"": ""English""}]",Released,Saving the world takes a little Hart and a big Johnson,Central Intelligence,6.2,1650,6.3
289,50000000,"[{""id"": 35, ""name"": ""Comedy""}]",http://daddyshomemovie.tumblr.com/,274167,"[{""id"": 230024, ""name"": ""daddys home""}]",en,Daddy's Home,"The story of a mild-mannered radio executive (Ferrell) who strives to become the best stepdad ever to his wife's two children, but complications ensue when their freewheeling, freeloading real father arrives, forcing stepdad to compete for the affection of the kids.",38.616744,"[{""name"": ""Paramount Pictures"", ""id"": 4}, {""name"": ""Gary Sanchez Productions"", ""id"": 4740}, {""name"": ""Red Granite Pictures"", ""id"": 19177}]","[{""iso_3166_1"": ""US"", ""name"": ""United States of America""}]",2015-12-25,242786137,96.0,"[{""iso_639_1"": ""en"", ""name"": ""English""}]",Released,Choose your Daddy,Daddy's Home,5.8,854,6.1
290,50000000,"[{""id"": 14, ""name"": ""Fantasy""}, {""id"": 35, ""name"": ""Comedy""}, {""id"": 10402, ""name"": ""Music""}]",http://movies.disney.com/into-the-woods/,224141,"[{""id"": 616, ""name"": ""witch""}, {""id"": 995, ""name"": ""cinderella""}, {""id"": 3071, ""name"": ""prince""}, {""id"": 3205, ""name"": ""fairy tale""}, {""id"": 4344, ""name"": ""musical""}, {""id"": 7376, ""name"": ""princess""}, {""id"": 10449, ""name"": ""sondheim""}, {""id"": 10541, ""name"": ""curse""}, {""id"": 158375, ""name"": ""based on stage musical""}, {""id"": 166472, ""name"": ""beanstalk""}, {""id"": 179431, ""name"": ""duringcreditsstinger""}, {""id"": 192993, ""name"": ""red riding hood""}]",en,Into the Woods,"In a woods filled with magic and fairy tale characters, a baker and his wife set out to end the curse put on them by their neighbor, a spiteful witch.",65.90160999999999,"[{""name"": ""Walt Disney Pictures"", ""id"": 2}, {""name"": ""Marc Platt Productions"", ""id"": 2527}, {""name"": ""Lucamar Productions"", ""id"": 17021}]","[{""iso_3166_1"": ""US"", ""name"": ""United States of America""}]",2014-12-25,212902372,125.0,"[{""iso_639_1"": ""en"", ""name"": ""English""}]",Released,Be careful what you wish for...,Into the Woods,5.6,1652,6.0
291,45000000,"[{""id"": 80, ""name"": ""Crime""}, {""id"": 18, ""name"": ""Drama""}, {""id"": 53, ""name"": ""Thriller""}]",http://theinsideman.net,388,"[{""id"": 1929, ""name"": ""bank manager""}, {""id"": 1930, ""name"": ""kidnapping""}, {""id"": 1933, ""name"": ""nazi background""}, {""id"": 1937, ""name"": ""document""}, {""id"": 1954, ""name"": ""ultimatum""}, {""id"": 3012, ""name"": ""court case""}, {""id"": 10051, ""name"": ""heist""}, {""id"": 33672, ""name"": ""financial transactions""}]",en,Inside Man,"Bank robber Dalton Russell enters a Manhattan bank, locks the doors and takes hostages, working methodically and without haste. Detective Frazier is assigned to negotiate, but his mind is occupied with the corruption charges he is facing. With an army of police surrounding the bank, the thief, the cop and a high-profile 'fixer' enter high-stakes negotiations.",45.220386,"[{""name"": ""Imagine Entertainment"", ""id"": 23}, {""name"": ""Universal Pictures"", ""id"": 33}, {""name"": ""40 Acres & A Mule Filmworks"", ""id"": 4319}]","[{""iso_3166_1"": ""US"", ""name"": ""United States of America""}]",2006-03-23,184376254,129.0,"[{""iso_639_1"": ""en"", ""name"": ""English""}, {""iso_639_1"": ""sq"", ""name"": ""shqip""}]",Released,It looked like the perfect bank robbery. But you can't judge a crime by its cover.,Inside Man,7.3,1630,7.6
292,50000000,"[{""id"": 35, ""name"": ""Comedy""}, {""id"": 18, ""name"": ""Drama""}, {""id"": 10749, ""name"": ""Romance""}]",http://crazystupidlove.warnerbros.com/index.html,50646,"[{""id"": 815, ""name"": ""soulmates""}, {""id"": 1599, ""name"": ""midlife crisis""}, {""id"": 5809, ""name"": ""marriage crisis""}, {""id"": 9094, ""name"": ""womanizer""}, {""id"": 9798, ""name"": ""law school""}, {""id"": 14532, ""name"": ""crazy""}, {""id"": 14534, ""name"": ""relationship""}]",en,"Crazy, Stupid, Love.","Cal Weaver is living the American dream. He has a good job, a beautiful house, great children and a beautiful wife, named Emily. Cal's seemingly perfect life unravels, however, when he learns that Emily has been unfaithful and wants a divorce. Over 40 and suddenly single, Cal is adrift in the fickle world of dating. Enter, Jacob Palmer, a self-styled player who takes Cal under his wing and teaches him how to be a hit with the ladies.",37.990705,"[{""name"": ""Warner Bros."", ""id"": 6194}]","[{""iso_3166_1"": ""US"", ""name"": ""United States of America""}]",2011-07-29,142851197,118.0,"[{""iso_639_1"": ""en"", ""name"": ""English""}]",Released,This Is Stupid,"Crazy, Stupid, Love.",7.0,2443,7.4
293,50000000,"[{""id"": 18, ""name"": ""Drama""}]",http://www.moneyball-movie.com/,60308,"[{""id"": 240, ""name"": ""underdog""}, {""id"": 818, ""name"": ""based on novel""}, {""id"": 1480, ""name"": ""baseball""}, {""id"": 4298, ""name"": ""teamwork""}, {""id"": 6075, ""name"": ""sport""}, {""id"": 9104, ""name"": ""partner""}, {""id"": 41153, ""name"": ""meeting""}, {""id"": 41604, ""name"": ""oakland california""}, {""id"": 158470, ""name"": ""strategy""}, {""id"": 159431, ""name"": ""voice over""}, {""id"": 204841, ""name"": ""statistics""}]",en,Moneyball,"The story of Oakland Athletics general manager Billy Beane's successful attempt to put together a baseball team on a budget, by employing computer-generated analysis to draft his players.",46.180421,"[{""name"": ""Columbia Pictures"", ""id"": 5}, {""name"": ""Scott Rudin Productions"", ""id"": 258}]","[{""iso_3166_1"": ""US"", ""name"": ""United States of America""}]",2011-09-22,110206216,133.0,"[{""iso_639_1"": ""en"", ""name"": ""English""}]",Released,What are you really worth?,Moneyball,7.0,1381,7.6
294,50000000,"[{""id"": 28, ""name"": ""Action""}, {""id"": 53, ""name"": ""Thriller""}, {""id"": 878, ""name"": ""Science Fiction""}, {""id"": 12, ""name"": ""Adventure""}]",http://www.findnumberfour.com/,46529,"[{""id"": 1308, ""name"": ""secret identity""}, {""id"": 9951, ""name"": ""alien""}, {""id"": 18068, ""name"": ""teenage boy""}, {""id"": 188178, ""name"": ""teenage hero""}, {""id"": 211359, ""name"": ""alien teenager""}, {""id"": 212760, ""name"": ""interspecies romance""}, {""id"": 223438, ""name"": ""based on young adult novel""}, {""id"": 234694, ""name"": ""superpowers""}]",en,I Am Number Four,"A teenage fugitive with an incredible secret races to stay one step ahead of the mysterious forces seeking destroy him in this sci-fi action thriller. With three dead and one on the run, the race to find the elusive Number Four begins. Outwardly normal teen John Smith never gets too comfortable in the same identity, and along with his guardian, Henri, he is constantly moving from town to town. With each passing day, John gains a stronger grasp on his extraordinary new powers, and his bond to the beings that share his fantastic fate grows stronger.",43.450266,"[{""name"": ""DreamWorks SKG"", ""id"": 27}, {""name"": ""Reliance BIG Entertainment"", ""id"": 6733}, {""name"": ""Bay Films"", ""id"": 6734}, {""name"": ""Touchstone Pictures"", ""id"": 9195}]","[{""iso_3166_1"": ""US"", ""name"": ""United States of America""}]",2011-02-18,144492830,109.0,"[{""iso_639_1"": ""fr"", ""name"": ""Fran\u00e7ais""}, {""iso_639_1"": ""en"", ""name"": ""English""}]",Released,Three like him have already been killed…he is Number Four.,I Am Number Four,5.9,1567,6.1
295,50000000,"[{""id"": 10749, ""name"": ""Romance""}, {""id"": 16, ""name"": ""Animation""}, {""id"": 12, ""name"": ""Adventure""}, {""id"": 35, ""name"": ""Comedy""}, {""id"": 10751, ""name"": ""Family""}, {""id"": 14, ""name"": ""Fantasy""}]",http://www.bookoflifemovie.com/,228326,"[{""id"": 128, ""name"": ""love triangle""}, {""id"": 6155, ""name"": ""afterlife""}, {""id"": 209789, ""name"": ""day of the dead""}, {""id"": 209790, ""name"": ""bullfighting""}]",en,The Book of Life,"The journey of Manolo, a young man who is torn between fulfilling the expectations of his family and following his heart. Before choosing which path to follow, he embarks on an incredible adventure that spans three fantastical worlds where he must face his greatest fears.",34.890999,"[{""name"": ""Twentieth Century Fox Film Corporation"", ""id"": 306}, {""name"": ""Reel FX Creative Studios"", ""id"": 2787}, {""name"": ""Twentieth Century Fox Animation"", ""id"": 11749}, {""name"": ""Chatrone"", ""id"": 79031}]","[{""iso_3166_1"": ""MX"", ""name"": ""Mexico""}, {""iso_3166_1"": ""US"", ""name"": ""United States of America""}]",2014-10-01,97437106,95.0,"[{""iso_639_1"": ""en"", ""name"": ""English""}]",Released,,The Book of Life,7.3,755,7.3
296,50000000,"[{""id"": 27, ""name"": ""Horror""}, {""id"": 9648, ""name"": ""Mystery""}]",http://www.sonypictures.com/homevideo/silenthill/,588,"[{""id"": 1299, ""name"": ""monster""}, {""id"": 2784, ""name"": ""mother role""}, {""id"": 2871, ""name"": ""burning of witches""}, {""id"": 3002, ""name"": ""fog""}, {""id"": 3032, ""name"": ""suffering""}, {""id"": 3762, ""name"": ""darkness""}, {""id"": 4426, ""name"": ""sadism""}, {""id"": 6152, ""name"": ""supernatural""}, {""id"": 9748, ""name"": ""revenge""}, {""id"": 9887, ""name"": ""surrealism""}, {""id"": 10292, ""name"": ""gore""}, {""id"": 10349, ""name"": ""survival""}, {""id"": 10842, ""name"": ""good vs evil""}, {""id"": 11221, ""name"": ""blood""}, {""id"": 12446, ""name"": ""another dimension""}, {""id"": 13006, ""name"": ""torture""}, {""id"": 13031, ""name"": ""creature""}, {""id"": 14819, ""name"": ""violence""}, {""id"": 15001, ""name"": ""demon""}, {""id"": 40929, ""name"": ""witch burning""}, {""id"": 41645, ""name"": ""based on video game""}, {""id"": 157444, ""name"": ""dismemberment""}, {""id"": 161264, ""name"": ""religious fanatic""}, {""id"": 166701, ""name"": ""ghost town""}, {""id"": 179878, ""name"": ""sleepwalking""}]",en,Silent Hill,"The eerie and deserted ghost town of Silent Hill draws a young mother desperate to find a cure for her only child's illness. Unable to accept the doctor's diagnosis that her daughter should be permanently institutionalized for psychiatric care, Rose flees with her child, heading for the abandoned town in search of answers – and ignoring the protests of her husband. It's soon clear this place is unlike anywhere she's ever been. It's smothered by fog, inhabited by a variety of strange beings and periodically overcome by a living 'darkness' that literally transforms everything it touches. As Rose searches for her little girl, she begins to learn the history of the strange town and realizes that her daughter is just a pawn in a larger game.",32.927994,"[{""name"": ""Silent Hill DCP Inc."", ""id"": 341}, {""name"": ""Davis-Films"", ""id"": 342}, {""name"": ""TriStar Pictures"", ""id"": 559}, {""name"": ""Konami"", ""id"": 55914}]","[{""iso_3166_1"": ""CA"", ""name"": ""Canada""}, {""iso_3166_1"": ""FR"", ""name"": ""France""}, {""iso_3166_1"": ""JP"", ""name"": ""Japan""}, {""iso_3166_1"": ""US"", ""name"": ""United States of America""}]",2006-04-21,97607453,125.0,"[{""iso_639_1"": ""en"", ""name"": ""English""}]",Released,We've been expecting you.,Silent Hill,6.3,1067,6.6
297,50000000,"[{""id"": 35, ""name"": ""Comedy""}]",http://www.americanreunionmovie.com/,71552,"[{""id"": 1157, ""name"": ""wife husband relationship""}, {""id"": 9663, ""name"": ""sequel""}, {""id"": 18187, ""name"": ""family reunion""}, {""id"": 33451, ""name"": ""masturbation""}, {""id"": 161158, ""name"": ""scat""}, {""id"": 161213, ""name"": ""high school reunion""}, {""id"": 179173, ""name"": ""quitting a job""}, {""id"": 179178, ""name"": ""milf""}, {""id"": 179431, ""name"": ""duringcreditsstinger""}]",en,American Reunion,"The characters we met a little more than a decade ago are returning to East Great Falls for their high-school reunion. In one long-overdue weekend, they will discover what has changed, who hasn’t and that time and distance can’t break the bonds of friendship. It was summer 1999 when four small-town Michigan boys began a quest to lose their virginity. In the years that have passed, Jim and Michelle married while Kevin and Vicky said goodbye. Oz and Heather grew apart, but Finch still longs for Stifler’s mom. Now these lifelong friends have come home as adults to reminisce about – and get inspired by – the hormonal teens who launched a comedy legend.",39.920035,"[{""name"": ""Universal Pictures"", ""id"": 33}]","[{""iso_3166_1"": ""US"", ""name"": ""United States of America""}]",2012-04-04,234989584,113.0,"[{""iso_639_1"": ""en"", ""name"": ""English""}]",Released,Save the best piece for last.,American Reunion,6.1,1611,6.7
298,50000000,"[{""id"": 18, ""name"": ""Drama""}]",http://thejudgemovie.com/,205587,"[{""id"": 494, ""name"": ""father son relationship""}, {""id"": 934, ""name"": ""judge""}, {""id"": 10909, ""name"": ""lawyer""}]",en,The Judge,"A successful lawyer returns to his hometown for his mother's funeral only to discover that his estranged father, the town's judge, is suspected of murder.",42.472324,"[{""name"": ""Village Roadshow Pictures"", ""id"": 79}, {""name"": ""Warner Bros."", ""id"": 6194}, {""name"": ""Big Kid Pictures"", ""id"": 8406}, {""name"": ""Team Downey"", ""id"": 27467}]","[{""iso_3166_1"": ""US"", ""name"": ""United States of America""}]",2014-10-08,83719388,141.0,"[{""iso_639_1"": ""en"", ""name"": ""English""}]",Released,Defend your Honor.,The Judge,7.2,1417,7.4
299,44000000,"[{""id"": 28, ""name"": ""Action""}, {""id"": 12, ""name"": ""Adventure""}, {""id"": 10749, ""name"": ""Romance""}, {""id"": 878, ""name"": ""Science Fiction""}, {""id"": 53, ""name"": ""Thriller""}]",,72710,"[{""id"": 818, ""name"": ""based on novel""}, {""id"": 1583, ""name"": ""mass murder""}, {""id"": 4565, ""name"": ""dystopia""}, {""id"": 14900, ""name"": ""genocide""}, {""id"": 14909, ""name"": ""alien invasion""}, {""id"": 179431, ""name"": ""duringcreditsstinger""}, {""id"": 212760, ""name"": ""interspecies romance""}, {""id"": 220392, ""name"": ""alien parasites""}]",en,The Host,"A parasitic alien soul is injected into the body of Melanie Stryder. Instead of carrying out her race's mission of taking over the Earth, ""Wanda"" (as she comes to be called) forms a bond with her host and sets out to aid other free humans.",42.933027,"[{""name"": ""Nick Wechsler Productions"", ""id"": 8073}, {""name"": ""Open Road Films"", ""id"": 10427}, {""name"": ""Silver Reel"", ""id"": 12075}, {""name"": ""Chockstone Pictures"", ""id"": 13649}]","[{""iso_3166_1"": ""US"", ""name"": ""United States of America""}]",2013-03-22,63327201,125.0,"[{""iso_639_1"": ""en"", ""name"": ""English""}]",Released,You will be one of us,The Host,6.0,1817,5.9
300,44000000,"[{""id"": 28, ""name"": ""Action""}, {""id"": 12, ""name"": ""Adventure""}, {""id"": 10749, ""name"": ""Romance""}, {""id"": 878, ""name"": ""Science Fiction""}, {""id"": 53, ""name"": ""Thriller""}]",,72710,"[{""id"": 818, ""name"": ""based on novel""}, {""id"": 1583, ""name"": ""mass murder""}, {""id"": 4565, ""name"": ""dystopia""}, {""id"": 14900, ""name"": ""genocide""}, {""id"": 14909, ""name"": ""alien invasion""}, {""id"": 179431, ""name"": ""duringcreditsstinger""}, {""id"": 212760, ""name"": ""interspecies romance""}, {""id"": 220392, ""name"": ""alien parasites""}]",en,The Host,"A parasitic alien soul is injected into the body of Melanie Stryder. Instead of carrying out her race's mission of taking over the Earth, ""Wanda"" (as she comes to be called) forms a bond with her host and sets out to aid other free humans.",42.933027,"[{""name"": ""Nick Wechsler Productions"", ""id"": 8073}, {""name"": ""Open Road Films"", ""id"": 10427}, {""name"": ""Silver Reel"", ""id"": 12075}, {""name"": ""Chockstone Pictures"", ""id"": 13649}]","[{""iso_3166_1"": ""US"", ""name"": ""United States of America""}]",2013-03-22,63327201,125.0,"[{""iso_639_1"": ""en"", ""name"": ""English""}]",Released,You will be one of us,The Host,6.0,1817,7.0
301,50000000,"[{""id"": 10752, ""name"": ""War""}, {""id"": 28, ""name"": ""Action""}, {""id"": 18, ""name"": ""Drama""}, {""id"": 36, ""name"": ""History""}, {""id"": 53, ""name"": ""Thriller""}]",http://stxmovies.com/freestateofjones/,316152,"[{""id"": 2831, ""name"": ""slavery""}, {""id"": 179585, ""name"": ""american civil war""}]",en,Free State of Jones,"In 1863, Mississippi farmer Newt Knight serves as a medic for the Confederate Army. Opposed to slavery, Knight would rather help the wounded than fight the Union. After his nephew dies in battle, Newt returns home to Jones County to safeguard his family but is soon branded an outlaw deserter. Forced to flee, he finds refuge with a group of runaway slaves hiding out in the swamps. Forging an alliance with the slaves and other farmers, Knight leads a rebellion that would forever change history.",21.589392999999998,"[{""name"": ""Larger Than Life Productions"", ""id"": 1163}, {""name"": ""Vendian Entertainment"", ""id"": 50481}, {""name"": ""Route One Films"", ""id"": 50482}]","[{""iso_3166_1"": ""US"", ""name"": ""United States of America""}]",2016-06-24,25035950,139.0,"[{""iso_639_1"": ""en"", ""name"": ""English""}, {""iso_639_1"": ""de"", ""name"": ""Deutsch""}]",Released,Based on the incredible true story.,Free State of Jones,6.6,428,6.9
