,budget,genres,homepage,id,keywords,original_language,Title,overview,popularity,production_companies,production_countries,release_date,revenue,runtime,spoken_languages,status,tagline,title,vote_average,vote_count,Rating
0,237000000,"[{""id"": 28, ""name"": ""Action""}, {""id"": 12, ""name"": ""Adventure""}, {""id"": 14, ""name"": ""Fantasy""}, {""id"": 878, ""name"": ""Science Fiction""}]",http://www.avatarmovie.com/,19995,"[{""id"": 1463, ""name"": ""culture clash""}, {""id"": 2964, ""name"": ""future""}, {""id"": 3386, ""name"": ""space war""}, {""id"": 3388, ""name"": ""space colony""}, {""id"": 3679, ""name"": ""society""}, {""id"": 3801, ""name"": ""space travel""}, {""id"": 9685, ""name"": ""futuristic""}, {""id"": 9840, ""name"": ""romance""}, {""id"": 9882, ""name"": ""space""}, {""id"": 9951, ""name"": ""alien""}, {""id"": 10148, ""name"": ""tribe""}, {""id"": 10158, ""name"": ""alien planet""}, {""id"": 10987, ""name"": ""cgi""}, {""id"": 11399, ""name"": ""marine""}, {""id"": 13065, ""name"": ""soldier""}, {""id"": 14643, ""name"": ""battle""}, {""id"": 14720, ""name"": ""love affair""}, {""id"": 165431, ""name"": ""anti war""}, {""id"": 193554, ""name"": ""power relations""}, {""id"": 206690, ""name"": ""mind and soul""}, {""id"": 209714, ""name"": ""3d""}]",en,Avatar,"In the 22nd century, a paraplegic Marine is dispatched to the moon Pandora on a unique mission, but becomes torn between following orders and protecting an alien civilization.",150.437577,"[{""name"": ""Ingenious Film Partners"", ""id"": 289}, {""name"": ""Twentieth Century Fox Film Corporation"", ""id"": 306}, {""name"": ""Dune Entertainment"", ""id"": 444}, {""name"": ""Lightstorm Entertainment"", ""id"": 574}]","[{""iso_3166_1"": ""US"", ""name"": ""United States of America""}, {""iso_3166_1"": ""GB"", ""name"": ""United Kingdom""}]",2009-12-10,2787965087,162.0,"[{""iso_639_1"": ""en"", ""name"": ""English""}, {""iso_639_1"": ""es"", ""name"": ""Espa\u00f1ol""}]",Released,Enter the World of Pandora.,Avatar,7.2,11800,7.8
1,300000000,"[{""id"": 12, ""name"": ""Adventure""}, {""id"": 14, ""name"": ""Fantasy""}, {""id"": 28, ""name"": ""Action""}]",http://disney.go.com/disneypictures/pirates/,285,"[{""id"": 270, ""name"": ""ocean""}, {""id"": 726, ""name"": ""drug abuse""}, {""id"": 911, ""name"": ""exotic island""}, {""id"": 1319, ""name"": ""east india trading company""}, {""id"": 2038, ""name"": ""love of one's life""}, {""id"": 2052, ""name"": ""traitor""}, {""id"": 2580, ""name"": ""shipwreck""}, {""id"": 2660, ""name"": ""strong woman""}, {""id"": 3799, ""name"": ""ship""}, {""id"": 5740, ""name"": ""alliance""}, {""id"": 5941, ""name"": ""calypso""}, {""id"": 6155, ""name"": ""afterlife""}, {""id"": 6211, ""name"": ""fighter""}, {""id"": 12988, ""name"": ""pirate""}, {""id"": 157186, ""name"": ""swashbuckler""}, {""id"": 179430, ""name"": ""aftercreditsstinger""}]",en,Pirates of the Caribbean: At World's End,"Captain Barbossa, long believed to be dead, has come back to life and is headed to the edge of the Earth with Will Turner and Elizabeth Swann. But nothing is quite as it seems.",139.082615,"[{""name"": ""Walt Disney Pictures"", ""id"": 2}, {""name"": ""Jerry Bruckheimer Films"", ""id"": 130}, {""name"": ""Second Mate Productions"", ""id"": 19936}]","[{""iso_3166_1"": ""US"", ""name"": ""United States of America""}]",2007-05-19,961000000,169.0,"[{""iso_639_1"": ""en"", ""name"": ""English""}]",Released,"At the end of the world, the adventure begins.",Pirates of the Caribbean: At World's End,6.9,4500,7.1
2,245000000,"[{""id"": 28, ""name"": ""Action""}, {""id"": 12, ""name"": ""Adventure""}, {""id"": 80, ""name"": ""Crime""}]",http://www.sonypictures.com/movies/spectre/,206647,"[{""id"": 470, ""name"": ""spy""}, {""id"": 818, ""name"": ""based on novel""}, {""id"": 4289, ""name"": ""secret agent""}, {""id"": 9663, ""name"": ""sequel""}, {""id"": 14555, ""name"": ""mi6""}, {""id"": 156095, ""name"": ""british secret service""}, {""id"": 158431, ""name"": ""united kingdom""}]",en,Spectre,"A cryptic message from Bond’s past sends him on a trail to uncover a sinister organization. While M battles political forces to keep the secret service alive, Bond peels back the layers of deceit to reveal the terrible truth behind SPECTRE.",107.37678799999999,"[{""name"": ""Columbia Pictures"", ""id"": 5}, {""name"": ""Danjaq"", ""id"": 10761}, {""name"": ""B24"", ""id"": 69434}]","[{""iso_3166_1"": ""GB"", ""name"": ""United Kingdom""}, {""iso_3166_1"": ""US"", ""name"": ""United States of America""}]",2015-10-26,880674609,148.0,"[{""iso_639_1"": ""fr"", ""name"": ""Fran\u00e7ais""}, {""iso_639_1"": ""en"", ""name"": ""English""}, {""iso_639_1"": ""es"", ""name"": ""Espa\u00f1ol""}, {""iso_639_1"": ""it"", ""name"": ""Italiano""}, {""iso_639_1"": ""de"", ""name"": ""Deutsch""}]",Released,A Plan No One Escapes,Spectre,6.3,4466,6.8
3,250000000,"[{""id"": 28, ""name"": ""Action""}, {""id"": 80, ""name"": ""Crime""}, {""id"": 18, ""name"": ""Drama""}, {""id"": 53, ""name"": ""Thriller""}]",http://www.thedarkknightrises.com/,49026,"[{""id"": 849, ""name"": ""dc comics""}, {""id"": 853, ""name"": ""crime fighter""}, {""id"": 949, ""name"": ""terrorist""}, {""id"": 1308, ""name"": ""secret identity""}, {""id"": 1437, ""name"": ""burglar""}, {""id"": 3051, ""name"": ""hostage drama""}, {""id"": 3562, ""name"": ""time bomb""}, {""id"": 6969, ""name"": ""gotham city""}, {""id"": 7002, ""name"": ""vigilante""}, {""id"": 9665, ""name"": ""cover-up""}, {""id"": 9715, ""name"": ""superhero""}, {""id"": 9990, ""name"": ""villainess""}, {""id"": 10044, ""name"": ""tragic hero""}, {""id"": 13015, ""name"": ""terrorism""}, {""id"": 14796, ""name"": ""destruction""}, {""id"": 18933, ""name"": ""catwoman""}, {""id"": 156082, ""name"": ""cat burglar""}, {""id"": 156395, ""name"": ""imax""}, {""id"": 173272, ""name"": ""flood""}, {""id"": 179093, ""name"": ""criminal underworld""}, {""id"": 230775, ""name"": ""batman""}]",en,The Dark Knight Rises,"Following the death of District Attorney Harvey Dent, Batman assumes responsibility for Dent's crimes to protect the late attorney's reputation and is subsequently hunted by the Gotham City Police Department. Eight years later, Batman encounters the mysterious Selina Kyle and the villainous Bane, a new terrorist leader who overwhelms Gotham's finest. The Dark Knight resurfaces to protect a city that has branded him an enemy.",112.31295,"[{""name"": ""Legendary Pictures"", ""id"": 923}, {""name"": ""Warner Bros."", ""id"": 6194}, {""name"": ""DC Entertainment"", ""id"": 9993}, {""name"": ""Syncopy"", ""id"": 9996}]","[{""iso_3166_1"": ""US"", ""name"": ""United States of America""}]",2012-07-16,1084939099,165.0,"[{""iso_639_1"": ""en"", ""name"": ""English""}]",Released,The Legend Ends,The Dark Knight Rises,7.6,9106,8.5
4,260000000,"[{""id"": 28, ""name"": ""Action""}, {""id"": 12, ""name"": ""Adventure""}, {""id"": 878, ""name"": ""Science Fiction""}]",http://movies.disney.com/john-carter,49529,"[{""id"": 818, ""name"": ""based on novel""}, {""id"": 839, ""name"": ""mars""}, {""id"": 1456, ""name"": ""medallion""}, {""id"": 3801, ""name"": ""space travel""}, {""id"": 7376, ""name"": ""princess""}, {""id"": 9951, ""name"": ""alien""}, {""id"": 10028, ""name"": ""steampunk""}, {""id"": 10539, ""name"": ""martian""}, {""id"": 10685, ""name"": ""escape""}, {""id"": 161511, ""name"": ""edgar rice burroughs""}, {""id"": 163252, ""name"": ""alien race""}, {""id"": 179102, ""name"": ""superhuman strength""}, {""id"": 190320, ""name"": ""mars civilization""}, {""id"": 195446, ""name"": ""sword and planet""}, {""id"": 207928, ""name"": ""19th century""}, {""id"": 209714, ""name"": ""3d""}]",en,John Carter,"John Carter is a war-weary, former military captain who's inexplicably transported to the mysterious and exotic planet of Barsoom (Mars) and reluctantly becomes embroiled in an epic conflict. It's a world on the brink of collapse, and Carter rediscovers his humanity when he realizes the survival of Barsoom and its people rests in his hands.",43.926995,"[{""name"": ""Walt Disney Pictures"", ""id"": 2}]","[{""iso_3166_1"": ""US"", ""name"": ""United States of America""}]",2012-03-07,284139100,132.0,"[{""iso_639_1"": ""en"", ""name"": ""English""}]",Released,"Lost in our world, found in another.",John Carter,6.1,2124,6.6
5,258000000,"[{""id"": 14, ""name"": ""Fantasy""}, {""id"": 28, ""name"": ""Action""}, {""id"": 12, ""name"": ""Adventure""}]",http://www.sonypictures.com/movies/spider-man3/,559,"[{""id"": 851, ""name"": ""dual identity""}, {""id"": 1453, ""name"": ""amnesia""}, {""id"": 1965, ""name"": ""sandstorm""}, {""id"": 2038, ""name"": ""love of one's life""}, {""id"": 3446, ""name"": ""forgiveness""}, {""id"": 3986, ""name"": ""spider""}, {""id"": 4391, ""name"": ""wretch""}, {""id"": 4959, ""name"": ""death of a friend""}, {""id"": 5776, ""name"": ""egomania""}, {""id"": 5789, ""name"": ""sand""}, {""id"": 5857, ""name"": ""narcism""}, {""id"": 6062, ""name"": ""hostility""}, {""id"": 8828, ""name"": ""marvel comic""}, {""id"": 9663, ""name"": ""sequel""}, {""id"": 9715, ""name"": ""superhero""}, {""id"": 9748, ""name"": ""revenge""}]",en,Spider-Man 3,"The seemingly invincible Spider-Man goes up against an all-new crop of villain – including the shape-shifting Sandman. While Spider-Man’s superpowers are altered by an alien organism, his alter ego, Peter Parker, deals with nemesis Eddie Brock and also gets caught up in a love triangle.",115.69981399999999,"[{""name"": ""Columbia Pictures"", ""id"": 5}, {""name"": ""Laura Ziskin Productions"", ""id"": 326}, {""name"": ""Marvel Enterprises"", ""id"": 19551}]","[{""iso_3166_1"": ""US"", ""name"": ""United States of America""}]",2007-05-01,890871626,139.0,"[{""iso_639_1"": ""en"", ""name"": ""English""}, {""iso_639_1"": ""fr"", ""name"": ""Fran\u00e7ais""}]",Released,The battle within.,Spider-Man 3,5.9,3576,6.2
6,260000000,"[{""id"": 16, ""name"": ""Animation""}, {""id"": 10751, ""name"": ""Family""}]",http://disney.go.com/disneypictures/tangled/,38757,"[{""id"": 1562, ""name"": ""hostage""}, {""id"": 2343, ""name"": ""magic""}, {""id"": 2673, ""name"": ""horse""}, {""id"": 3205, ""name"": ""fairy tale""}, {""id"": 4344, ""name"": ""musical""}, {""id"": 7376, ""name"": ""princess""}, {""id"": 10336, ""name"": ""animation""}, {""id"": 33787, ""name"": ""tower""}, {""id"": 155658, ""name"": ""blonde woman""}, {""id"": 162219, ""name"": ""selfishness""}, {""id"": 163545, ""name"": ""healing power""}, {""id"": 179411, ""name"": ""based on fairy tale""}, {""id"": 179431, ""name"": ""duringcreditsstinger""}, {""id"": 215258, ""name"": ""healing gift""}, {""id"": 234183, ""name"": ""animal sidekick""}]",en,Tangled,"When the kingdom's most wanted-and most charming-bandit Flynn Rider hides out in a mysterious tower, he's taken hostage by Rapunzel, a beautiful and feisty tower-bound teen with 70 feet of magical, golden hair. Flynn's curious captor, who's looking for her ticket out of the tower where she's been locked away for years, strikes a deal with the handsome thief and the unlikely duo sets off on an action-packed escapade, complete with a super-cop horse, an over-protective chameleon and a gruff gang of pub thugs.",48.681969,"[{""name"": ""Walt Disney Pictures"", ""id"": 2}, {""name"": ""Walt Disney Animation Studios"", ""id"": 6125}]","[{""iso_3166_1"": ""US"", ""name"": ""United States of America""}]",2010-11-24,591794936,100.0,"[{""iso_639_1"": ""en"", ""name"": ""English""}]",Released,They're taking adventure to new lengths.,Tangled,7.4,3330,7.8
7,280000000,"[{""id"": 28, ""name"": ""Action""}, {""id"": 12, ""name"": ""Adventure""}, {""id"": 878, ""name"": ""Science Fiction""}]",http://marvel.com/movies/movie/193/avengers_age_of_ultron,99861,"[{""id"": 8828, ""name"": ""marvel comic""}, {""id"": 9663, ""name"": ""sequel""}, {""id"": 9715, ""name"": ""superhero""}, {""id"": 9717, ""name"": ""based on comic book""}, {""id"": 10629, ""name"": ""vision""}, {""id"": 155030, ""name"": ""superhero team""}, {""id"": 179431, ""name"": ""duringcreditsstinger""}, {""id"": 180547, ""name"": ""marvel cinematic universe""}, {""id"": 209714, ""name"": ""3d""}]",en,Avengers: Age of Ultron,"When Tony Stark tries to jumpstart a dormant peacekeeping program, things go awry and Earth’s Mightiest Heroes are put to the ultimate test as the fate of the planet hangs in the balance. As the villainous Ultron emerges, it is up to The Avengers to stop him from enacting his terrible plans, and soon uneasy alliances and unexpected action pave the way for an epic and unique global adventure.",134.27922900000002,"[{""name"": ""Marvel Studios"", ""id"": 420}, {""name"": ""Prime Focus"", ""id"": 15357}, {""name"": ""Revolution Sun Studios"", ""id"": 76043}]","[{""iso_3166_1"": ""US"", ""name"": ""United States of America""}]",2015-04-22,1405403694,141.0,"[{""iso_639_1"": ""en"", ""name"": ""English""}]",Released,A New Age Has Come.,Avengers: Age of Ultron,7.3,6767,7.4
8,250000000,"[{""id"": 12, ""name"": ""Adventure""}, {""id"": 14, ""name"": ""Fantasy""}, {""id"": 10751, ""name"": ""Family""}]",http://harrypotter.warnerbros.com/harrypotterandthehalf-bloodprince/dvd/index.html,767,"[{""id"": 616, ""name"": ""witch""}, {""id"": 2343, ""name"": ""magic""}, {""id"": 3872, ""name"": ""broom""}, {""id"": 3884, ""name"": ""school of witchcraft""}, {""id"": 6333, ""name"": ""wizardry""}, {""id"": 10164, ""name"": ""apparition""}, {""id"": 10791, ""name"": ""teenage crush""}, {""id"": 12564, ""name"": ""werewolf""}]",en,Harry Potter and the Half-Blood Prince,"As Harry begins his sixth year at Hogwarts, he discovers an old book marked as 'Property of the Half-Blood Prince', and begins to learn more about Lord Voldemort's dark past.",98.885637,"[{""name"": ""Warner Bros."", ""id"": 6194}, {""name"": ""Heyday Films"", ""id"": 7364}]","[{""iso_3166_1"": ""GB"", ""name"": ""United Kingdom""}, {""iso_3166_1"": ""US"", ""name"": ""United States of America""}]",2009-07-07,933959197,153.0,"[{""iso_639_1"": ""en"", ""name"": ""English""}]",Released,Dark Secrets Revealed,Harry Potter and the Half-Blood Prince,7.4,5293,7.5
9,250000000,"[{""id"": 28, ""name"": ""Action""}, {""id"": 12, ""name"": ""Adventure""}, {""id"": 14, ""name"": ""Fantasy""}]",http://www.batmanvsupermandawnofjustice.com/,209112,"[{""id"": 849, ""name"": ""dc comics""}, {""id"": 7002, ""name"": ""vigilante""}, {""id"": 9715, ""name"": ""superhero""}, {""id"": 9717, ""name"": ""based on comic book""}, {""id"": 9748, ""name"": ""revenge""}, {""id"": 163455, ""name"": ""super powers""}, {""id"": 195242, ""name"": ""clark kent""}, {""id"": 195243, ""name"": ""bruce wayne""}, {""id"": 229266, ""name"": ""dc extended universe""}]",en,Batman v Superman: Dawn of Justice,"Fearing the actions of a god-like Super Hero left unchecked, Gotham City’s own formidable, forceful vigilante takes on Metropolis’s most revered, modern-day savior, while the world wrestles with what sort of hero it really needs. And with Batman and Superman at war with one another, a new threat quickly arises, putting mankind in greater danger than it’s ever known before.",155.790452,"[{""name"": ""DC Comics"", ""id"": 429}, {""name"": ""Atlas Entertainment"", ""id"": 507}, {""name"": ""Warner Bros."", ""id"": 6194}, {""name"": ""DC Entertainment"", ""id"": 9993}, {""name"": ""Cruel & Unusual Films"", ""id"": 9995}, {""name"": ""RatPac-Dune Entertainment"", ""id"": 41624}]","[{""iso_3166_1"": ""US"", ""name"": ""United States of America""}]",2016-03-23,873260194,151.0,"[{""iso_639_1"": ""en"", ""name"": ""English""}]",Released,Justice or revenge,Batman v Superman: Dawn of Justice,5.7,7004,6.7
10,270000000,"[{""id"": 12, ""name"": ""Adventure""}, {""id"": 14, ""name"": ""Fantasy""}, {""id"": 28, ""name"": ""Action""}, {""id"": 878, ""name"": ""Science Fiction""}]",http://www.superman.com,1452,"[{""id"": 83, ""name"": ""saving the world""}, {""id"": 849, ""name"": ""dc comics""}, {""id"": 8872, ""name"": ""invulnerability""}, {""id"": 9663, ""name"": ""sequel""}, {""id"": 9715, ""name"": ""superhero""}, {""id"": 9717, ""name"": ""based on comic book""}, {""id"": 163420, ""name"": ""kryptonite""}, {""id"": 163455, ""name"": ""super powers""}, {""id"": 179102, ""name"": ""superhuman strength""}, {""id"": 202526, ""name"": ""lex luthor""}]",en,Superman Returns,"Superman returns to discover his 5-year absence has allowed Lex Luthor to walk free, and that those he was closest too felt abandoned and have moved on. Luthor plots his ultimate revenge that could see millions killed and change the face of the planet forever, as well as ridding himself of the Man of Steel.",57.925623,"[{""name"": ""DC Comics"", ""id"": 429}, {""name"": ""Legendary Pictures"", ""id"": 923}, {""name"": ""Warner Bros."", ""id"": 6194}, {""name"": ""Bad Hat Harry Productions"", ""id"": 9168}]","[{""iso_3166_1"": ""US"", ""name"": ""United States of America""}]",2006-06-28,391081192,154.0,"[{""iso_639_1"": ""en"", ""name"": ""English""}, {""iso_639_1"": ""fr"", ""name"": ""Fran\u00e7ais""}, {""iso_639_1"": ""de"", ""name"": ""Deutsch""}]",Released,,Superman Returns,5.4,1400,6.1
11,200000000,"[{""id"": 12, ""name"": ""Adventure""}, {""id"": 28, ""name"": ""Action""}, {""id"": 53, ""name"": ""Thriller""}, {""id"": 80, ""name"": ""Crime""}]",http://www.mgm.com/view/movie/234/Quantum-of-Solace/,10764,"[{""id"": 627, ""name"": ""killing""}, {""id"": 1568, ""name"": ""undercover""}, {""id"": 4289, ""name"": ""secret agent""}, {""id"": 156095, ""name"": ""british secret service""}]",en,Quantum of Solace,"Quantum of Solace continues the adventures of James Bond after Casino Royale. Betrayed by Vesper, the woman he loved, 007 fights the urge to make his latest mission personal. Pursuing his determination to uncover the truth, Bond and M interrogate Mr. White, who reveals that the organization that blackmailed Vesper is far more complex and dangerous than anyone had imagined.",107.92881100000001,"[{""name"": ""Eon Productions"", ""id"": 7576}]","[{""iso_3166_1"": ""GB"", ""name"": ""United Kingdom""}, {""iso_3166_1"": ""US"", ""name"": ""United States of America""}]",2008-10-30,586090727,106.0,"[{""iso_639_1"": ""en"", ""name"": ""English""}, {""iso_639_1"": ""es"", ""name"": ""Espa\u00f1ol""}, {""iso_639_1"": ""it"", ""name"": ""Italiano""}, {""iso_639_1"": ""fr"", ""name"": ""Fran\u00e7ais""}, {""iso_639_1"": ""de"", ""name"": ""Deutsch""}]",Released,"For love, for hate, for justice, for revenge.",Quantum of Solace,6.1,2965,6.6
12,200000000,"[{""id"": 12, ""name"": ""Adventure""}, {""id"": 14, ""name"": ""Fantasy""}, {""id"": 28, ""name"": ""Action""}]",http://disney.go.com/disneypictures/pirates/,58,"[{""id"": 616, ""name"": ""witch""}, {""id"": 663, ""name"": ""fortune teller""}, {""id"": 910, ""name"": ""bondage""}, {""id"": 911, ""name"": ""exotic island""}, {""id"": 1299, ""name"": ""monster""}, {""id"": 1316, ""name"": ""captain""}, {""id"": 1317, ""name"": ""card game""}, {""id"": 1319, ""name"": ""east india trading company""}, {""id"": 1461, ""name"": ""compass""}, {""id"": 3799, ""name"": ""ship""}, {""id"": 5600, ""name"": ""daughter""}, {""id"": 12988, ""name"": ""pirate""}, {""id"": 157186, ""name"": ""swashbuckler""}, {""id"": 179430, ""name"": ""aftercreditsstinger""}]",en,Pirates of the Caribbean: Dead Man's Chest,"Captain Jack Sparrow works his way out of a blood debt with the ghostly Davey Jones, he also attempts to avoid eternal damnation.",145.84737900000002,"[{""name"": ""Walt Disney Pictures"", ""id"": 2}, {""name"": ""Jerry Bruckheimer Films"", ""id"": 130}, {""name"": ""Second Mate Productions"", ""id"": 19936}]","[{""iso_3166_1"": ""JM"", ""name"": ""Jamaica""}, {""iso_3166_1"": ""US"", ""name"": ""United States of America""}, {""iso_3166_1"": ""BS"", ""name"": ""Bahamas""}, {""iso_3166_1"": ""DM"", ""name"": ""Dominica""}]",2006-06-20,1065659812,151.0,"[{""iso_639_1"": ""en"", ""name"": ""English""}, {""iso_639_1"": ""tr"", ""name"": ""T\u00fcrk\u00e7e""}, {""iso_639_1"": ""el"", ""name"": ""\u03b5\u03bb\u03bb\u03b7\u03bd\u03b9\u03ba\u03ac""}, {""iso_639_1"": ""zh"", ""name"": ""\u666e\u901a\u8bdd""}]",Released,Jack is back!,Pirates of the Caribbean: Dead Man's Chest,7.0,5246,7.3
13,255000000,"[{""id"": 28, ""name"": ""Action""}, {""id"": 12, ""name"": ""Adventure""}, {""id"": 37, ""name"": ""Western""}]",http://disney.go.com/the-lone-ranger/,57201,"[{""id"": 1556, ""name"": ""texas""}, {""id"": 2673, ""name"": ""horse""}, {""id"": 5385, ""name"": ""survivor""}, {""id"": 5901, ""name"": ""texas ranger""}, {""id"": 9104, ""name"": ""partner""}, {""id"": 9503, ""name"": ""outlaw""}, {""id"": 10685, ""name"": ""escape""}, {""id"": 10909, ""name"": ""lawyer""}, {""id"": 13008, ""name"": ""train""}, {""id"": 178867, ""name"": ""lone ranger""}, {""id"": 179419, ""name"": ""comanche""}, {""id"": 222787, ""name"": ""the lone ranger""}, {""id"": 228232, ""name"": ""tonto""}]",en,The Lone Ranger,"The Texas Rangers chase down a gang of outlaws led by Butch Cavendish, but the gang ambushes the Rangers, seemingly killing them all. One survivor is found, however, by an American Indian named Tonto, who nurses him back to health. The Ranger, donning a mask and riding a white stallion named Silver, teams up with Tonto to bring the unscrupulous gang and others of that ilk to justice.",49.046956,"[{""name"": ""Walt Disney Pictures"", ""id"": 2}, {""name"": ""Jerry Bruckheimer Films"", ""id"": 130}, {""name"": ""Infinitum Nihil"", ""id"": 2691}, {""name"": ""Silver Bullet Productions (II)"", ""id"": 37380}, {""name"": ""Blind Wink Productions"", ""id"": 37381}, {""name"": ""Classic Media"", ""id"": 37382}]","[{""iso_3166_1"": ""US"", ""name"": ""United States of America""}]",2013-07-03,89289910,149.0,"[{""iso_639_1"": ""en"", ""name"": ""English""}]",Released,Never Take Off the Mask,The Lone Ranger,5.9,2311,6.5
14,225000000,"[{""id"": 28, ""name"": ""Action""}, {""id"": 12, ""name"": ""Adventure""}, {""id"": 14, ""name"": ""Fantasy""}, {""id"": 878, ""name"": ""Science Fiction""}]",http://www.manofsteel.com/,49521,"[{""id"": 83, ""name"": ""saving the world""}, {""id"": 849, ""name"": ""dc comics""}, {""id"": 9715, ""name"": ""superhero""}, {""id"": 9717, ""name"": ""based on comic book""}, {""id"": 10761, ""name"": ""superhuman""}, {""id"": 14909, ""name"": ""alien invasion""}, {""id"": 161184, ""name"": ""reboot""}, {""id"": 163455, ""name"": ""super powers""}, {""id"": 229266, ""name"": ""dc extended universe""}]",en,Man of Steel,"A young boy learns that he has extraordinary powers and is not of this earth. As a young man, he journeys to discover where he came from and what he was sent here to do. But the hero in him must emerge if he is to save the world from annihilation and become the symbol of hope for all mankind.",99.398009,"[{""name"": ""Legendary Pictures"", ""id"": 923}, {""name"": ""Warner Bros."", ""id"": 6194}, {""name"": ""DC Entertainment"", ""id"": 9993}, {""name"": ""Syncopy"", ""id"": 9996}, {""name"": ""Cruel and Unusual Films"", ""id"": 78685}]","[{""iso_3166_1"": ""GB"", ""name"": ""United Kingdom""}, {""iso_3166_1"": ""US"", ""name"": ""United States of America""}]",2013-06-12,662845518,143.0,"[{""iso_639_1"": ""en"", ""name"": ""English""}]",Released,You will believe that a man can fly.,Man of Steel,6.5,6359,7.1
15,220000000,"[{""id"": 878, ""name"": ""Science Fiction""}, {""id"": 28, ""name"": ""Action""}, {""id"": 12, ""name"": ""Adventure""}]",http://marvel.com/avengers_movie/,24428,"[{""id"": 242, ""name"": ""new york""}, {""id"": 5539, ""name"": ""shield""}, {""id"": 8828, ""name"": ""marvel comic""}, {""id"": 9715, ""name"": ""superhero""}, {""id"": 9717, ""name"": ""based on comic book""}, {""id"": 14909, ""name"": ""alien invasion""}, {""id"": 155030, ""name"": ""superhero team""}, {""id"": 179430, ""name"": ""aftercreditsstinger""}, {""id"": 179431, ""name"": ""duringcreditsstinger""}, {""id"": 180547, ""name"": ""marvel cinematic universe""}]",en,The Avengers,"When an unexpected enemy emerges and threatens global safety and security, Nick Fury, director of the international peacekeeping agency known as S.H.I.E.L.D., finds himself in need of a team to pull the world back from the brink of disaster. Spanning the globe, a daring recruitment effort begins!",144.448633,"[{""name"": ""Paramount Pictures"", ""id"": 4}, {""name"": ""Marvel Studios"", ""id"": 420}]","[{""iso_3166_1"": ""US"", ""name"": ""United States of America""}]",2012-04-25,1519557910,143.0,"[{""iso_639_1"": ""en"", ""name"": ""English""}]",Released,Some assembly required.,The Avengers,7.4,11776,8.1
