,budget,genres,homepage,id,keywords,original_language,Title,overview,popularity,production_companies,production_countries,release_date,revenue,runtime,spoken_languages,status,tagline,title,vote_average,vote_count,Rating
129,65000000,"[{""id"": 28, ""name"": ""Action""}, {""id"": 12, ""name"": ""Adventure""}, {""id"": 878, ""name"": ""Science Fiction""}]",,861,"[{""id"": 560, ""name"": ""oxygen""}, {""id"": 769, ""name"": ""falsely accused""}, {""id"": 836, ""name"": ""resistance""}, {""id"": 839, ""name"": ""mars""}, {""id"": 848, ""name"": ""double life""}, {""id"": 1475, ""name"": ""telepathy""}, {""id"": 1852, ""name"": ""mutant""}, {""id"": 3249, ""name"": ""hologram""}, {""id"": 3388, ""name"": ""space colony""}, {""id"": 3864, ""name"": ""false identity""}, {""id"": 4289, ""name"": ""secret agent""}, {""id"": 4565, ""name"": ""dystopia""}, {""id"": 12190, ""name"": ""cyberpunk""}, {""id"": 187008, ""name"": ""false memory""}, {""id"": 187046, ""name"": ""implanted memory""}]",en,Total Recall,"Construction worker Douglas Quaid discovers a memory chip in his brain during a virtual-reality trip. He also finds that his past has been invented to conceal a plot of planetary domination. Soon, he's off to Mars to find out who he is and who planted the chip.",43.129703000000006,"[{""name"": ""TriStar Pictures"", ""id"": 559}, {""name"": ""Carolco Pictures"", ""id"": 14723}, {""name"": ""Carolco International N.V."", ""id"": 80461}]","[{""iso_3166_1"": ""US"", ""name"": ""United States of America""}]",1990-06-01,261317921,113.0,"[{""iso_639_1"": ""en"", ""name"": ""English""}]",Released,"They stole his mind, now he wants it back.",Total Recall,7.1,1710,6.3
130,130000000,"[{""id"": 28, ""name"": ""Action""}, {""id"": 53, ""name"": ""Thriller""}]",http://www.thebournelegacy.com/,49040,"[{""id"": 782, ""name"": ""assassin""}, {""id"": 1994, ""name"": ""wolf""}, {""id"": 5729, ""name"": ""maryland""}, {""id"": 11767, ""name"": ""suicide by gunshot""}, {""id"": 15219, ""name"": ""rooftop""}, {""id"": 18067, ""name"": ""exploding house""}, {""id"": 18254, ""name"": ""laptop""}, {""id"": 181620, ""name"": ""tracking device""}, {""id"": 181623, ""name"": ""fake id""}, {""id"": 181628, ""name"": ""seoul south korea""}, {""id"": 181632, ""name"": ""pharmaceutical lab""}, {""id"": 181635, ""name"": ""government conspiracy""}, {""id"": 181637, ""name"": ""roof chase""}, {""id"": 181641, ""name"": ""manila philippines""}, {""id"": 181644, ""name"": ""hunted""}, {""id"": 181648, ""name"": ""false passport""}, {""id"": 181650, ""name"": ""alberta canada""}, {""id"": 181651, ""name"": ""lieutenant general""}]",en,The Bourne Legacy,"New CIA operative, Aaron Cross experiences life-or-death stakes that have been triggered by the previous actions of Jason Bourne.",90.33681,"[{""name"": ""Universal Pictures"", ""id"": 33}, {""name"": ""Dentsu"", ""id"": 6452}, {""name"": ""Relativity Media"", ""id"": 7295}, {""name"": ""Kennedy/Marshall Company, The"", ""id"": 7383}, {""name"": ""Captivate Entertainment"", ""id"": 25716}]","[{""iso_3166_1"": ""US"", ""name"": ""United States of America""}]",2012-08-08,276572938,120.0,"[{""iso_639_1"": ""en"", ""name"": ""English""}, {""iso_639_1"": ""ru"", ""name"": ""P\u0443\u0441\u0441\u043a\u0438\u0439""}]",Released,There Was Never Just One,The Bourne Legacy,6.0,2651,6.7
131,120000000,"[{""id"": 12, ""name"": ""Adventure""}, {""id"": 18, ""name"": ""Drama""}, {""id"": 28, ""name"": ""Action""}]",http://www.lifeofpimovie.com/,87827,"[{""id"": 270, ""name"": ""ocean""}, {""id"": 2580, ""name"": ""shipwreck""}, {""id"": 4096, ""name"": ""hindu""}, {""id"": 4809, ""name"": ""tiger""}, {""id"": 6150, ""name"": ""faith""}, {""id"": 12971, ""name"": ""zookeeper""}, {""id"": 18068, ""name"": ""teenage boy""}, {""id"": 158022, ""name"": ""cargo ship""}, {""id"": 163000, ""name"": ""lifeboat""}, {""id"": 163014, ""name"": ""injured animal""}]",en,Life of Pi,"The story of an Indian boy named Pi, a zookeeper's son who finds himself in the company of a hyena, zebra, orangutan, and a Bengal tiger after a shipwreck sets them adrift in the Pacific Ocean.",51.328145,"[{""name"": ""Ingenious Film Partners"", ""id"": 289}, {""name"": ""Ingenious Media"", ""id"": 290}, {""name"": ""Dune Entertainment"", ""id"": 444}, {""name"": ""Fox 2000 Pictures"", ""id"": 711}, {""name"": ""Big Screen Productions"", ""id"": 10893}, {""name"": ""Haishang Films"", ""id"": 13480}]","[{""iso_3166_1"": ""US"", ""name"": ""United States of America""}, {""iso_3166_1"": ""TW"", ""name"": ""Taiwan""}, {""iso_3166_1"": ""GB"", ""name"": ""United Kingdom""}]",2012-11-20,609016565,127.0,"[{""iso_639_1"": ""zh"", ""name"": ""\u666e\u901a\u8bdd""}, {""iso_639_1"": ""en"", ""name"": ""English""}, {""iso_639_1"": ""fr"", ""name"": ""Fran\u00e7ais""}, {""iso_639_1"": ""hi"", ""name"": ""\u0939\u093f\u0928\u094d\u0926\u0940""}, {""iso_639_1"": ""ja"", ""name"": ""\u65e5\u672c\u8a9e""}, {""iso_639_1"": ""ta"", ""name"": ""\u0ba4\u0bae\u0bbf\u0bb4\u0bcd""}]",Released,Believe The Unbelievable,Life of Pi,7.2,5797,7.9
132,110000000,"[{""id"": 53, ""name"": ""Thriller""}, {""id"": 28, ""name"": ""Action""}, {""id"": 14, ""name"": ""Fantasy""}, {""id"": 27, ""name"": ""Horror""}]",http://www.sonypictures.com/movies/ghostrider/,1250,"[{""id"": 2870, ""name"": ""mephisto""}, {""id"": 3684, ""name"": ""religion and supernatural""}, {""id"": 3737, ""name"": ""dying and death""}, {""id"": 4084, ""name"": ""devil's son""}, {""id"": 5280, ""name"": ""ghost world""}, {""id"": 5452, ""name"": ""stunts""}, {""id"": 5454, ""name"": ""flame""}, {""id"": 9717, ""name"": ""based on comic book""}]",en,Ghost Rider,"In order to save his dying father, young stunt cyclist, Johnny Blaze sells his soul to Mephistopheles and sadly parts from the pure-hearted, Roxanne Simpson, the love of his life. Years later, Johnny's path crosses again with Roxanne, now a go-getting reporter, and also with Mephistopheles, who offers to release Johnny's soul if Johnny becomes the fabled, fiery 'Ghost Rider'.",46.834703999999995,"[{""name"": ""Columbia Pictures Corporation"", ""id"": 441}, {""name"": ""Relativity Media"", ""id"": 7295}, {""name"": ""Michael De Luca Productions"", ""id"": 11370}, {""name"": ""Marvel Enterprises"", ""id"": 19551}, {""name"": ""Crystal Sky Pictures"", ""id"": 20241}, {""name"": ""GH One"", ""id"": 20475}, {""name"": ""Vengeance Productions Pty. Ltd."", ""id"": 20476}]","[{""iso_3166_1"": ""US"", ""name"": ""United States of America""}, {""iso_3166_1"": ""AU"", ""name"": ""Australia""}]",2007-02-16,228738393,114.0,"[{""iso_639_1"": ""en"", ""name"": ""English""}]",Released,Hell Is About To Be Unleashed,Ghost Rider,5.2,1712,5.2
133,120000000,"[{""id"": 28, ""name"": ""Action""}, {""id"": 53, ""name"": ""Thriller""}]",http://www.jasonbournemovie.com,324668,"[{""id"": 782, ""name"": ""assassin""}, {""id"": 1453, ""name"": ""amnesia""}, {""id"": 187844, ""name"": ""flashback""}]",en,Jason Bourne,The most dangerous former operative of the CIA is drawn out of hiding to uncover hidden truths about his past.,62.641286,"[{""name"": ""The Kennedy/Marshall Company"", ""id"": 862}, {""name"": ""Captivate Entertainment"", ""id"": 25716}, {""name"": ""Pearl Street Films"", ""id"": 29313}, {""name"": ""Double Negative"", ""id"": 31922}, {""name"": ""Perfect World (Beijing) Pictures Co."", ""id"": 83871}]","[{""iso_3166_1"": ""GB"", ""name"": ""United Kingdom""}, {""iso_3166_1"": ""US"", ""name"": ""United States of America""}, {""iso_3166_1"": ""CN"", ""name"": ""China""}]",2016-07-27,415484914,123.0,"[{""iso_639_1"": ""en"", ""name"": ""English""}]",Released,You know his name,Jason Bourne,5.9,2341,6.7
134,130000000,"[{""id"": 878, ""name"": ""Science Fiction""}, {""id"": 12, ""name"": ""Adventure""}, {""id"": 9648, ""name"": ""Mystery""}]",http://www.projectprometheus.com/,70981,"[{""id"": 803, ""name"": ""android""}, {""id"": 4565, ""name"": ""dystopia""}, {""id"": 9951, ""name"": ""alien""}, {""id"": 15285, ""name"": ""spin off""}, {""id"": 163402, ""name"": ""creation""}, {""id"": 168835, ""name"": ""emergency surgery""}, {""id"": 179430, ""name"": ""aftercreditsstinger""}, {""id"": 181895, ""name"": ""stasis""}, {""id"": 181900, ""name"": ""archeological dig""}, {""id"": 181905, ""name"": ""god complex""}, {""id"": 181908, ""name"": ""cave drawing""}, {""id"": 233300, ""name"": ""genetic mutation""}, {""id"": 236312, ""name"": ""origins of life""}]",en,Prometheus,"A team of explorers discover a clue to the origins of mankind on Earth, leading them on a journey to the darkest corners of the universe. There, they must fight a terrifying battle to save the future of the human race.",68.889395,"[{""name"": ""Twentieth Century Fox Film Corporation"", ""id"": 306}, {""name"": ""Dune Entertainment"", ""id"": 444}, {""name"": ""Scott Free Productions"", ""id"": 1645}, {""name"": ""Brandywine Productions"", ""id"": 19747}]","[{""iso_3166_1"": ""GB"", ""name"": ""United Kingdom""}, {""iso_3166_1"": ""US"", ""name"": ""United States of America""}]",2012-05-30,403170142,124.0,"[{""iso_639_1"": ""gd"", ""name"": """"}, {""iso_639_1"": ""en"", ""name"": ""English""}]",Released,The Search for Our Beginning Could Lead to Our End.,Prometheus,6.3,5080,7.0
135,115000000,"[{""id"": 878, ""name"": ""Science Fiction""}, {""id"": 28, ""name"": ""Action""}, {""id"": 18, ""name"": ""Drama""}, {""id"": 53, ""name"": ""Thriller""}]",,68724,"[{""id"": 4565, ""name"": ""dystopia""}, {""id"": 156039, ""name"": ""space station""}, {""id"": 179823, ""name"": ""class conflict""}]",en,Elysium,"In the year 2159, two classes of people exist: the very wealthy who live on a pristine man-made space station called Elysium, and the rest, who live on an overpopulated, ruined Earth. Secretary Rhodes (Jodie Foster), a hard line government ofﬁcial, will stop at nothing to enforce anti-immigration laws and preserve the luxurious lifestyle of the citizens of Elysium. That doesn’t stop the people of Earth from trying to get in, by any means they can. When unlucky Max (Matt Damon) is backed into a corner, he agrees to take on a daunting mission that, if successful, will not only save his life, but could bring equality to these polarized worlds.",67.33766999999999,"[{""name"": ""TriStar Pictures"", ""id"": 559}, {""name"": ""Media Rights Capital"", ""id"": 2531}, {""name"": ""Sony Pictures Entertainment (SPE)"", ""id"": 7431}, {""name"": ""QED International"", ""id"": 11029}, {""name"": ""Alpha Core"", ""id"": 18209}, {""name"": ""Genre Films"", ""id"": 28788}, {""name"": ""Simon Kinberg Productions"", ""id"": 31076}]","[{""iso_3166_1"": ""US"", ""name"": ""United States of America""}]",2013-08-07,286140700,109.0,"[{""iso_639_1"": ""en"", ""name"": ""English""}]",Released,He can save us all.,Elysium,6.4,3439,6.6
136,120000000,"[{""id"": 28, ""name"": ""Action""}, {""id"": 878, ""name"": ""Science Fiction""}]",http://www.robocop.com,97020,"[{""id"": 679, ""name"": ""cyborg""}, {""id"": 2964, ""name"": ""future""}, {""id"": 4565, ""name"": ""dystopia""}, {""id"": 6149, ""name"": ""police""}, {""id"": 9714, ""name"": ""remake""}, {""id"": 14819, ""name"": ""violence""}, {""id"": 18021, ""name"": ""detroit""}]",en,RoboCop,"In RoboCop, the year is 2028 and multinational conglomerate OmniCorp is at the center of robot technology.  Overseas, their drones have been used by the military for years, but have been forbidden for law enforcement in America.  Now OmniCorp wants to bring their controversial technology to the home front, and they see a golden opportunity to do it.  When Alex Murphy – a loving husband, father and good cop doing his best to stem the tide of crime and corruption in Detroit – is critically injured, OmniCorp sees their chance to build a part-man, part-robot police officer.  OmniCorp envisions a RoboCop in every city and even more billions for their shareholders, but they never counted on one thing: there is still a man inside the machine.",66.757869,"[{""name"": ""Columbia Pictures"", ""id"": 5}, {""name"": ""Strike Entertainment"", ""id"": 655}, {""name"": ""Metro-Goldwyn-Mayer (MGM)"", ""id"": 8411}]","[{""iso_3166_1"": ""CA"", ""name"": ""Canada""}, {""iso_3166_1"": ""US"", ""name"": ""United States of America""}]",2014-01-30,242688965,102.0,"[{""iso_639_1"": ""en"", ""name"": ""English""}]",Released,We've got the future under control.,RoboCop,5.7,2342,6.2
137,120000000,"[{""id"": 28, ""name"": ""Action""}, {""id"": 878, ""name"": ""Science Fiction""}, {""id"": 12, ""name"": ""Adventure""}, {""id"": 9648, ""name"": ""Mystery""}]",https://www.uphe.com/movies/oblivion,75612,"[{""id"": 1612, ""name"": ""spacecraft""}, {""id"": 4565, ""name"": ""dystopia""}, {""id"": 9882, ""name"": ""space""}, {""id"": 11930, ""name"": ""drone""}, {""id"": 156395, ""name"": ""imax""}, {""id"": 186497, ""name"": ""human vs alien""}]",en,Oblivion,"Jack Harper is one of the last few drone repairmen stationed on Earth.  Part of a massive operation to extract vital resources after decades of war with a terrifying threat known as the Scavs, Jack’s mission is nearly complete.  His existence is brought crashing down when he rescues a beautiful  stranger from a downed spacecraft.  Her arrival triggers a chain of events that  forces him to question everything he knows and puts the fate of humanity in his hands.",67.698004,"[{""name"": ""Universal Pictures"", ""id"": 33}, {""name"": ""Chernin Entertainment"", ""id"": 7076}, {""name"": ""Relativity Media"", ""id"": 7295}, {""name"": ""Monolith Pictures (III)"", ""id"": 19647}, {""name"": ""Radical Studios"", ""id"": 19648}]","[{""iso_3166_1"": ""US"", ""name"": ""United States of America""}]",2013-04-10,286168572,124.0,"[{""iso_639_1"": ""en"", ""name"": ""English""}]",Released,Earth is a memory worth fighting for,Oblivion,6.4,4800,7.0
138,120000000,"[{""id"": 28, ""name"": ""Action""}, {""id"": 878, ""name"": ""Science Fiction""}, {""id"": 12, ""name"": ""Adventure""}, {""id"": 14, ""name"": ""Fantasy""}]",http://www.thewolverinemovie.com,76170,"[{""id"": 233, ""name"": ""japan""}, {""id"": 1462, ""name"": ""samurai""}, {""id"": 1852, ""name"": ""mutant""}, {""id"": 2504, ""name"": ""world war i""}, {""id"": 8828, ""name"": ""marvel comic""}, {""id"": 9715, ""name"": ""superhero""}, {""id"": 9717, ""name"": ""based on comic book""}, {""id"": 10761, ""name"": ""superhuman""}, {""id"": 179431, ""name"": ""duringcreditsstinger""}]",en,The Wolverine,"Wolverine faces his ultimate nemesis - and tests of his physical, emotional, and mortal limits - in a life-changing voyage to modern-day Japan.",15.953444000000001,"[{""name"": ""Twentieth Century Fox Film Corporation"", ""id"": 306}, {""name"": ""Donners' Company"", ""id"": 431}, {""name"": ""Marvel Entertainment"", ""id"": 7505}, {""name"": ""Bad Hat Harry Productions"", ""id"": 9168}, {""name"": ""Big Screen Productions"", ""id"": 10893}, {""name"": ""TSG Entertainment"", ""id"": 22213}]","[{""iso_3166_1"": ""GB"", ""name"": ""United Kingdom""}, {""iso_3166_1"": ""US"", ""name"": ""United States of America""}]",2013-07-23,415440673,126.0,"[{""iso_639_1"": ""en"", ""name"": ""English""}]",Released,"When he's most vulnerable, he's most dangerous.",The Wolverine,6.3,4053,6.7
139,115000000,"[{""id"": 28, ""name"": ""Action""}, {""id"": 12, ""name"": ""Adventure""}, {""id"": 18, ""name"": ""Drama""}]",http://www.thehuntsmanmovie.com/,290595,"[{""id"": 616, ""name"": ""witch""}, {""id"": 2343, ""name"": ""magic""}, {""id"": 3205, ""name"": ""fairy tale""}, {""id"": 169341, ""name"": ""snow white""}, {""id"": 211392, ""name"": ""huntsman""}]",en,The Huntsman: Winter's War,"As two evil sisters prepare to conquer the land, two renegades—Eric the Huntsman, who aided Snow White in defeating Ravenna in Snowwhite and the Huntsman, and his forbidden lover, Sara—set out to stop them.",60.467983999999994,"[{""name"": ""Universal Pictures"", ""id"": 33}, {""name"": ""Perfect World Pictures"", ""id"": 10338}, {""name"": ""Roth Films"", ""id"": 16314}]","[{""iso_3166_1"": ""US"", ""name"": ""United States of America""}]",2016-04-06,164602163,114.0,"[{""iso_639_1"": ""en"", ""name"": ""English""}]",Released,The story before Snow White,The Huntsman: Winter's War,6.0,1523,6.1
140,125000000,"[{""id"": 878, ""name"": ""Science Fiction""}, {""id"": 28, ""name"": ""Action""}, {""id"": 12, ""name"": ""Adventure""}, {""id"": 14, ""name"": ""Fantasy""}, {""id"": 35, ""name"": ""Comedy""}]",http://www.teenagemutantninjaturtlesmovie.com,98566,"[{""id"": 779, ""name"": ""martial arts""}, {""id"": 949, ""name"": ""terrorist""}, {""id"": 1701, ""name"": ""hero""}, {""id"": 2766, ""name"": ""mutation""}, {""id"": 4580, ""name"": ""van""}, {""id"": 6362, ""name"": ""turtle""}, {""id"": 7002, ""name"": ""vigilante""}, {""id"": 9715, ""name"": ""superhero""}, {""id"": 9717, ""name"": ""based on comic book""}, {""id"": 10278, ""name"": ""ninja""}, {""id"": 14512, ""name"": ""new york city""}, {""id"": 41412, ""name"": ""sewer""}, {""id"": 161184, ""name"": ""reboot""}, {""id"": 198781, ""name"": ""science experiment""}, {""id"": 209714, ""name"": ""3d""}]",en,Teenage Mutant Ninja Turtles,The city needs heroes. Darkness has settled over New York City as Shredder and his evil Foot Clan have an iron grip on everything from the police to the politicians. The future is grim until four unlikely outcast brothers rise from the sewers and discover their destiny as Teenage Mutant Ninja Turtles. The Turtles must work with fearless reporter April and her wise-cracking cameraman Vern Fenwick to save the city and unravel Shredder's diabolical plan.,143.350376,"[{""name"": ""Paramount Pictures"", ""id"": 4}, {""name"": ""Nickelodeon Movies"", ""id"": 2348}, {""name"": ""Platinum Dunes"", ""id"": 2481}]","[{""iso_3166_1"": ""US"", ""name"": ""United States of America""}]",2014-08-07,477200000,101.0,"[{""iso_639_1"": ""en"", ""name"": ""English""}]",Released,Mysterious. Dangerous. Reptilious. You've never seen heroes like this.,Teenage Mutant Ninja Turtles,5.8,2636,5.9
141,105000000,"[{""id"": 878, ""name"": ""Science Fiction""}, {""id"": 53, ""name"": ""Thriller""}, {""id"": 18, ""name"": ""Drama""}]",http://gravitymovie.warnerbros.com/,49047,"[{""id"": 4040, ""name"": ""space mission""}, {""id"": 6203, ""name"": ""loss""}, {""id"": 9882, ""name"": ""space""}, {""id"": 14626, ""name"": ""astronaut""}, {""id"": 191586, ""name"": ""trapped in space""}]",en,Gravity,"Dr. Ryan Stone, a brilliant medical engineer on her first Shuttle mission, with veteran astronaut Matt Kowalsky in command of his last flight before retiring. But on a seemingly routine spacewalk, disaster strikes. The Shuttle is destroyed, leaving Stone and Kowalsky completely alone-tethered to nothing but each other and spiraling out into the blackness of space. The deafening silence tells them they have lost any link to Earth and any chance for rescue. As fear turns to panic, every gulp of air eats away at what little oxygen is left. But the only way home may be to go further out into the terrifying expanse of space.",110.153618,"[{""name"": ""Warner Bros."", ""id"": 6194}, {""name"": ""Heyday Films"", ""id"": 7364}, {""name"": ""Esperanto Filmoj"", ""id"": 7470}]","[{""iso_3166_1"": ""GB"", ""name"": ""United Kingdom""}, {""iso_3166_1"": ""US"", ""name"": ""United States of America""}]",2013-09-27,716392705,91.0,"[{""iso_639_1"": ""en"", ""name"": ""English""}]",Released,Don't Let Go,Gravity,7.3,5751,7.8
142,135000000,"[{""id"": 14, ""name"": ""Fantasy""}, {""id"": 28, ""name"": ""Action""}, {""id"": 12, ""name"": ""Adventure""}, {""id"": 35, ""name"": ""Comedy""}]",http://www.teenagemutantninjaturtlesmovie.com/,308531,"[{""id"": 380, ""name"": ""brother brother relationship""}, {""id"": 6362, ""name"": ""turtle""}, {""id"": 9663, ""name"": ""sequel""}, {""id"": 9717, ""name"": ""based on comic book""}, {""id"": 10278, ""name"": ""ninja""}, {""id"": 189359, ""name"": ""rat""}]",en,Teenage Mutant Ninja Turtles: Out of the Shadows,"After supervillain Shredder escapes custody, he joins forces with mad scientist Baxter Stockman and two dimwitted henchmen, Bebop and Rocksteady, to unleash a diabolical plan to take over the world. As the Turtles prepare to take on Shredder and his new crew, they find themselves facing an even greater evil with similar intentions: the notorious Krang.",39.873791,"[{""name"": ""Paramount Pictures"", ""id"": 4}, {""name"": ""Nickelodeon Movies"", ""id"": 2348}, {""name"": ""Platinum Dunes"", ""id"": 2481}, {""name"": ""5150 Action"", ""id"": 47354}, {""name"": ""Gama Entertainment Partners"", ""id"": 77208}]","[{""iso_3166_1"": ""CN"", ""name"": ""China""}, {""iso_3166_1"": ""US"", ""name"": ""United States of America""}, {""iso_3166_1"": ""HK"", ""name"": ""Hong Kong""}]",2016-06-01,245623848,112.0,"[{""iso_639_1"": ""en"", ""name"": ""English""}]",Released,Raise some shell.,Teenage Mutant Ninja Turtles: Out of the Shadows,5.8,963,6.0
143,120000000,"[{""id"": 28, ""name"": ""Action""}, {""id"": 12, ""name"": ""Adventure""}, {""id"": 878, ""name"": ""Science Fiction""}]",http://www.fantasticfourmovie.com/,166424,"[{""id"": 3822, ""name"": ""teleportation""}, {""id"": 4375, ""name"": ""transformation""}, {""id"": 5086, ""name"": ""telekinesis""}, {""id"": 7939, ""name"": ""portal""}, {""id"": 8828, ""name"": ""marvel comic""}, {""id"": 9715, ""name"": ""superhero""}, {""id"": 9717, ""name"": ""based on comic book""}, {""id"": 155030, ""name"": ""superhero team""}, {""id"": 160117, ""name"": ""fantastic four""}, {""id"": 191564, ""name"": ""body horror""}, {""id"": 205731, ""name"": ""invisible woman""}]",en,Fantastic Four,"Four young outsiders teleport to a dangerous universe, which alters their physical form in shocking ways. Their lives irrevocably upended, the team must learn to harness their daunting new abilities and work together to save Earth from a former friend turned enemy.",38.126095,"[{""name"": ""Twentieth Century Fox Film Corporation"", ""id"": 306}, {""name"": ""Marv Films"", ""id"": 5374}, {""name"": ""Marvel Entertainment"", ""id"": 7505}, {""name"": ""Constantin Film."", ""id"": 9078}, {""name"": ""Moving Picture Company (MPC)"", ""id"": 20478}, {""name"": ""TSG Entertainment"", ""id"": 22213}, {""name"": ""Genre Films"", ""id"": 28788}]","[{""iso_3166_1"": ""US"", ""name"": ""United States of America""}]",2015-08-05,167977596,100.0,"[{""iso_639_1"": ""en"", ""name"": ""English""}]",Released,Change is coming.,Fantastic Four,4.4,2278,4.3
144,110000000,"[{""id"": 28, ""name"": ""Action""}, {""id"": 18, ""name"": ""Drama""}, {""id"": 53, ""name"": ""Thriller""}]",http://www.sanandreasmovie.com/,254128,"[{""id"": 387, ""name"": ""california""}, {""id"": 3521, ""name"": ""earthquake""}, {""id"": 188351, ""name"": ""catastrophe""}, {""id"": 189411, ""name"": ""disaster film""}, {""id"": 209714, ""name"": ""3d""}, {""id"": 213895, ""name"": ""san andreas""}, {""id"": 213896, ""name"": ""san andreas california""}, {""id"": 222529, ""name"": ""rescue operation""}]",en,San Andreas,"In the aftermath of a massive earthquake in California, a rescue-chopper pilot makes a dangerous journey across the state in order to rescue his estranged daughter.",100.412364,"[{""name"": ""New Line Cinema"", ""id"": 12}, {""name"": ""Village Roadshow Pictures"", ""id"": 79}, {""name"": ""Warner Bros."", ""id"": 6194}, {""name"": ""Flynn Picture Company"", ""id"": 34081}]","[{""iso_3166_1"": ""CA"", ""name"": ""Canada""}, {""iso_3166_1"": ""US"", ""name"": ""United States of America""}, {""iso_3166_1"": ""AU"", ""name"": ""Australia""}]",2015-05-27,470490832,114.0,"[{""iso_639_1"": ""en"", ""name"": ""English""}]",Released,"A rescue pilot survived an earthquake, this is what happens next",San Andreas,6.0,2968,6.1
145,110000000,"[{""id"": 12, ""name"": ""Adventure""}, {""id"": 878, ""name"": ""Science Fiction""}, {""id"": 53, ""name"": ""Thriller""}]",http://www.thedivergentseries.movie/#insurgent,262500,"[{""id"": 818, ""name"": ""based on novel""}, {""id"": 2020, ""name"": ""revolution""}, {""id"": 4565, ""name"": ""dystopia""}, {""id"": 9663, ""name"": ""sequel""}, {""id"": 162988, ""name"": ""dystopic future""}, {""id"": 206298, ""name"": ""young adult""}, {""id"": 209714, ""name"": ""3d""}, {""id"": 211389, ""name"": ""divergent""}]",en,Insurgent,Beatrice Prior must confront her inner demons and continue her fight against a powerful alliance which threatens to tear her society apart.,103.71838699999999,"[{""name"": ""Summit Entertainment"", ""id"": 491}, {""name"": ""Mandeville Films"", ""id"": 10227}, {""name"": ""Red Wagon Entertainment"", ""id"": 14440}, {""name"": ""NeoReel"", ""id"": 24097}]","[{""iso_3166_1"": ""US"", ""name"": ""United States of America""}]",2015-03-18,295238201,119.0,"[{""iso_639_1"": ""en"", ""name"": ""English""}]",Released,One Choice Can Destroy You,Insurgent,6.2,3829,6.3
